"","text"
"541","@GraceRandolph Because I once got stung by a bee in my ear and my family called me dumbo for the longest time, so I had like a grudge against the movie but if I get the bumblebee movie I will gladly go watch dumbo plus I get a movie too :)))"
"542","Wait... Aoc is in the Dumbo movie?"
"543","went and saw dumbo with my mom and had taco bell which was fun but now that’s over i get to be anxious about my trip tomorrow for the rest of today <U+0001F605><U+0001F605><U+0001F605>"
"544","dumbo was literally take the greatest showman and make it 10x worse"
"545","Taking myself on a date to see Dumbo. <U+0001F60A>"
"546","Me and the wife about to check out this new Dumbo movie lol #vitamins"
"547","While @DannyDeVito was in #Toronto for the Canadian premiere of Dumbo, we played Moose or Elephant! Did you guess right?"
"548","I almost got to go home early, but some strange &amp; intoxicated man has come in, and I'm the only male employee, so I have to stay to make sure this dumbo doesn't do anything."
"549","@TIME Could be argued that Dumbo is making the cover of Times for the past few years of his administration..."
"550","Sos I’m at the movies about to watch dumbo and all these babies giving me baby fever <U+0001F97A>"
"551","march

the talented mr. ripley
diary of a country priest
transit
born in flames
dumbo (1941)
dragged across concrete
high life"
"552","@RangerD89202429 @jacindaardern What's the matter Dumbo? Don't like the taste of your own words being shoved back down your miserable throat?  I repeat: it is ridiculous to expect the PM of a country that has had 50 Muslims murdered (many refugees) to lecture another country about its treatment of Muslims."
"553","Watching Dumbo in the privacy of my room so I can ugly cry in peace"
"554","Right?! No way was I going near that movie, and I don’t even remember seeing it as a child, I just remember how upset it made me."
"555","@Akhenaten_aten_ @piperboywilliam <U+0001F1FA><U+0001F1F2><U+0001F5E3><U+FE0F><U+0001F50A>The Dumbo movie is propaganda. Children's ptogramming. How can movie ratings say this children's movie may be inappropriate for some young viewers. WTF <U+0001F5E3><U+FE0F><U+0001F4A8>"
"556","None of my friends want to watch dumbo with me <U+0001F97A>"
"557","who says i can’t cry before 8 in the morning"
"558","@slpng_giants_oz @AAMI @AbbottGlobal @ACSnewsfeed @ArrowfieldStud @AskDysonAU @auspost @BetEasy @BJTMarts @blinkist @bmwau @bookingcom @CocaColaAU @Coles @CommBank @Dumbo @Duracell @eBayAU @maccas Magda’s advice that NZ doesn’t have the Murdoch press is profoundly important. Australia’s Murdoch media constantly preaches hate and toxicity with intention of dividing and polarising Australians. Advertisers on Sky are funding social hatreds and identify their brands with hate."
"559","Twitter forgive my nakie face but which one do yall like better to go see dumbo ? Ill put the poll/pictures down below <U+0001F388><U+0001F418><U+0001F37F>"
"560","@realDonaldTrump @SenRickScott @senatemajldr @SenJohnBarrasso @SenBillCassidy You took away the part that made it cheaper, dumbo"
"561","@GraceRandolph I think the key with live action Disney remakes is to pay homage to the beloved films ie batb or jungle book, I think dumbo is too much like Alice it has a darker feel, I think it will have a high when lion king comes out and would have been the same for Aladdin if"
"562","Jay and I just watched Dumbo and it was so cute <U+0001F63F>"
"563","@Dumbo just ruin everything about my childhood and gut the heart of a movie."
"564","My life was significantly better two hours ago before I watched the Dumbo remake. Why would you change the greatest movie of all time?"
"565","I need someone to go see Dumbo with"
"566","“Nothing really touched me about dumbo. Didn’t warm up to any of the characters except Dumbo” lool what a mood @karishmaapatel"
"567","Brb, crying! 
Will someone please go see this with me?!?"
"568","necesito ir al cine a ver 4x4, dumbo y five feet apart y no tengo plata :("
"569","// That fandom is barely active, but if any of you have seen Dumbo, I have @FervidAerialist. I mean, her character I loved deeply, and bc Eva Green. Swoon."
"570","@GraceRandolph I feel so bad for dumbo. I really liked it."
"571","@Annakhait @UnplannedMovie @jack @joerogan Ya and they verified @Dumbo and have way less followers lol they aren’t even hiding their bias anymore"
"572","Disney’s Dumbo: 4 out of 5, literally on the border of 3 and 4.  Loved Dumbo (the character), the story was a little weird to me, I wanted less people, more about the animals. Loved the crane on the train when Dumbo was born. That’s from the original. #Dumbo #MovieReview"
"573","I just want to go see dumbo and cry???"
"574","@Emergencegrrl ...and exactly why I will never watch any form of Dumbo ever."
"575","Less than 0% chance these are dumbo Trump’s words."
"576","DUMBO has more jump scares than US."
"577","She decided to go to rub it in my face. It’s okay, I understand <U+0001F644>"
"578","Oh good Lord don't tell me the movie actually analyzes the aerodynamics of Dumbo"
"579","Don’t know why no one wants to see Dumbo

It’s the best movie you’ll ever see about a depressed creepy off-putting CGI elephant <U+0001F418>"
"580","About to see Dumbo. We brought tissues to the theater just in case."
"581","Holy shit the kid actors in #dumbo are fucking terrible"
"582","Best comment today in this site!"
"583","Dumbo emotionally scarred me to the point where my parents had to lock my dumbo stuffed animal and blanket out in the garage and everytime I saw them I would burst into tears"
"584","I thought she had a Wednesday Addams vibe going to be honest."
"585","Baby surprised me &amp; took me to see Dumbo... ugh my heart <U+2764><U+FE0F>"
"586","Yo, all this content tho. My ass was just trying to watch Dumbo and now I’m getting hit with all the goods <U+0001F627> HOLY SHIT today has been a day. What a day today has been. This is the Lord’s work right here."
"587","@Sanju_Verma_ @narendramodi @INCIndia When the dumbo has pichatees as his leader how can boorish nandy can understand any other calculation or numbers !! Forget it there are better things to do in life than correcting dumb ppl!"
"588","Fresh out of Dumbo a second time on IMAX. Yeah don’t love it any less. Might be my favorite Burton film since the 90s, likely Sleepy Hollow."
"589","Fresh out of Dumbo a second time on IMAX. Yeah don’t love it any less. Might be my favorite Burton film since likely Big Fish."
"590","One of the cutest movies I’ve ever seen"
"591","I blocked this entire movie out from when i first saw it as a child 

I KNOW I watched it

I remember distinct clips

And my soul knows we will NEVER put ourselves through that pain again!!

We blocked it out for a reason"
"592","I’m gonna buy mini dumbo and snorlax plushies for my couch one day bc of Jinyoung and Jaebeom"
"593","so storytime.....  last friday @WyldEndeavor and I went to @texasroadhouse in gilbert for dinner because we were going to see dumbo @RegalMovies  the movie.. fantastic... I love regal theaters.. however that is not why I am posting this storytime now."
"594","Yup. Exactly the part that scarred me."
"595","This new Dumbo movie from what I've seen only glorifies circuses and its disgusting."
"596","Interesting read. Click it."
"597","@dhruv_rathee Hey dumbo ppl like you who wanna be over smart and try to recreate ppl can't understand this.... Coz  you are slaves of person with negetive IQ"
"598","Wow con Dumbo

 WOOOOOOW<U+0001F60D>"
"599","me n talor saw dumbo and i’m <U+0001F97A><U+0001F97A><U+0001F97A><U+0001F97A>"
"600","Surprised with how much I liked #Dumbo"
"601","My mom and I both teared up watching Dumbo. We’re already back home and we’re still hella emotional. <U+0001F62D><U+0001F602>"
"602","For a Disney movie, Dumbo is really sad. It has a happy ending but damn I teared up a good 3 times. Then again I cried with the last 3 movies I watched: Life of Pi, If Beale Street Could Talk and A Star is Born."
"603","Saw Dumbo.
Me: Hurry up and get to the trippy dancing elephant scene.
Tim Burton: Hang on, gotta make Walt Disney the villain and burn down Disneyland with Disney CGI budget first."
"604","@adrianachechik how was dumbo I missed it but it doesnt seem to be getting good reviews"
"605","@CaseyJonesJr3 Dumbo. I don’t think it needs a reference image"
"606","@DisneyStudios @jeremy_pailler @LST_MIND @AdStothard These are beautiful. I had to pick my melting heart up off the floor at the theatre tonight. <U+0001F62D><U+0001F60D> #Dumbo #TimBurton <U+0001F44F><U+0001F3FB> #3D"
"607","@DisneyStudios @jeremy_pailler @LST_MIND @AdStothard These are beautiful. I had to pick my melting heart up off the floor at the theatre tonight. <U+0001F62D><U+0001F60D> #Dumbo #TimBurton <U+0001F44F><U+0001F3FB>"
"608","@Hyperionpdx Call of Dumbo"
"609","@washingtonpost Sorry but #Dumbo is tweeting from the oval office... <U+0001F62E>"
"610","They didn’t advertise for it that much tbh and the movie is from idk the 1940’s lolll I don’t even rember the original plot I just remember it was sad, I did think this new one was nice go take ya kids to see it peeps loll"
"611","@HillaryMonahan My husband said they live action remade Dumbo, to which I replied, sweet baby o’ mine never again who would watch that? I will never watch that* *probably watches and sobs first day on streaming"
"612","Is it wrong of me to want to see the new Dumbo movie?? <U+0001F418><U+0001F37F><U+0001F3AA><U+0001F62A>"
"613","@dhaniealex This reminds me of Dumbo being dropped off to Mrs. Jumbo by Mr. Stork when it was just a baby!"
"614","I learned with #Dumbo to never trust a white, rich business owner"
"615","@ashokepandit Dumbo @ashokepandit did not even read the article shared by @MaheshNBhatt ... in fact it exposes Ashoke Pandits phata hua chaddi."
"616","i literally cant watch dumbo in theatres cos i know i’ll sit and cry the entire time"
"617","Dumbo made me cry, but I still loved it so much <U+0001F418><U+2764><U+FE0F>"
"618","I really love dumbo #FallonTonight"
"619","@RealJack I would rather watch Dumbo with the kids. Kids at least love movies directed at them."
"620","Okay so y’all, I just saw Dumbo and it was cute af"
"621","@Jon_Favreau Looks awesome. Right now I hope everyone sees #Dumbo it's going through a viscous trolling effort right now."
"622","@Swordsfall1 As long as the villain/character being voiced isn't some racist caricature(i.e. crows from Dumbo), I don't really see the problem with the VA for said villain being black."
"623","@GraceRandolph Actually I didn’t even know dumbo was out already. Maybe I’ll see it this weekend"
"624","I just got new clothes !! I’m so spoiled . And I went to go watch dumbo<U+0001F60D> I love elephants I have a whole stuffed animal collection <U+0001F923>"
"625","To the people who got caught fucking in the back of a movie theater that was playing Dumbo tonight. Y'all are some fucking idiots. Lucky there weren't any kids in there cause y'all would be registered sex offenders then."
"626","Didn´t blow away box office , indeed.  But blew  it sure did ! / Close down da whole  "" sequel industry NOW !"
"627","@NullBot3443 @8_Bit_Oddish @Homo_Cakes @ThomohtTheLoco They have it NOW! JFC have you seen what EVERY marvel movie has made?!?! But it's EASY to fucking make shit that people DON'T want. Live action Aladdin, Dumbo, BFG and others.. you want something made? TELL THEM!"
"628","@TemurKhalid @brielarsonhq Heard there are negotiations underwway with Disney because after Captain Marvel and Dumbo not releasing in Pakistan, it has given a big blow to the cinemas. We can only hope."
"629","Nobody saw Dumbo so I'm forced to tell all you rubes that this is an actual line of dialogue spoken in Tim Burton's Dumbo (2019)"
"630","@aditgyawali335 @_ebhre Mine is a dumbo but loves me a lot. Things aren't perfect we make them perfect."
"631","Hmmm... people getting all up in arms at Disney over ""new"" Dumbo. Pretty sure the point was always circus' suck. Don't remember any of it. I've got a fun mind. Remembers random/ unimportant stuff #NotLikeTheOthers"
"632","@andysignore @PopcornedPlanet @Dumbo And we’ll be ready with Dumbo in Space."
"633","I’m going to go see dumbo tomorrow and I couldn’t be more excited <U+0001F602>"
"634","Bruh Dumbo wasn’t even good and the scene when the crowd makes fun of him BROKE ME IN HALF"
"635","Seriously, I'd sooner pay to see Dumbo."
"636","i really cried over dumbo like 4 times"
"637","Sensible because of #Dumbo"
"638","@CaseyJonesJr3 Back to the Future III

Dumbo (1941 obviously.)

every single Thomas movie

Paddington 2 cos it had 2 steam locomotives in it.

Christopher Robin

Yea I named all the good ones. Beat that."
"639","@CaseyJonesJr3 BTTF 3: Sierra Railroad no.3

Dumbo: Casey JR

Thomas: no use naming all of them lol

Paddington: Tornado and an LMS Crab, can't remember which one.

Christopher: it was filmed in the Bluebell and Keighley and Worth Valley Railways in the UK so must be one of their locomotives..."
"640","@undeadpaulbales @Dumbo @znation @MeetJoeGatt That’s a scary dude!  Reminiscent of Yul Bruner!"
"641","Three words: Unidentified Flying Oddball"
"642","@bunnytailstv Sorry I missed it <U+0001F610> 
I’m sure it was great 
(My wife wanted to see dumbo)<U+0001F418>"
"643","@tanwer_m @AamAadmiParty That’s done for security reasons, so that children do not face inconvenience. Dumbo"
"644","@RealJack Why would anyone be offended by anything someone as insignificant as this dumbo says?"
"645","@bethrajohnston I go to the cinema on my own loads I love it. Last week I saw captain marvel, Dumbo and  US <U+0001F642> yay for doing stuff alone"
"646","So the CGI dumbo failed to lift off?..

*badumtssss!!"
"647","OKAY this is so cute"
"648","I did watch Dumbo this evening. I highly recommend it. Michael Keaton is much better as the villain as The Founder taught us."
"649","#Dumbo Another Disney’s live-action adaptation that got engaging new characters and their intricacies. Tim Burton brought this baby elephant comes to life with hypnotizing visuals and heartening story for all ages! 3.5/5"
"650","Seeing it tomorrow night! <U+0001F418>#dumbo"
"651","4/1: went to the world trade center, had lunch with izzy, then went to dumbo for a bit"
"652","The IRL remake of Dumbo touches on a story that is relevant &amp; I won’t spoil that for you. But I think the original &amp; the remake emphasize that WRONGLY INCARCERATED MOTHERS SHOULD NOT BE SEPERATED FROM THEIR CHILDREN &amp; our criminal justice system is shit."
"653","Program Board Committee
Dir. Hernandez: Hi everyone! This week we have a couple of events that we want to make sure are on your radar. On Wednesday we will be hosting a free movie screening of Dumbo at Whittier Village Cinemas at 5pm in collaboration with WCTheRock and..."
"654","It’s a toss up between Bambi and Dumbo as the most fucking traumatic and upsetting “children’s movie” of all time. Fuck I’m getting all worked up just thinking about it."
"655","Ok but I really enjoyed dumbo"
"656","@rupasubramanya Dumbo 2013 Rally was after @narendramodi was nominated as a PM candidate by @BJP4India and latest rally is again on expectation of @BJP4India comfortably coming back to power

Nifty from 5200 in August 2013 today is at 11600.

Its out of ur syllabus of @incinida economics"
"657","I’m just trying to go watch Dumbo"
"658","dumbo just came out over the weekend, the circus decided to come to town"
"659","I hate it when I have time to go to a movie, want to go to a movie, but there are NO MOVIES to see. DON’T say Dumbo! That looks like a nightmare!"
"660","I watched Dumbo today and like 3 mins in I started crying with the opening scene"
"661","It's midnight and i'm crying about the dumbo commercial, send help"
"662","What a fucking dummy... these ppl in fast food at most places are very lazy... I work in fast food and there are so many lazy people. 

Plus we just raised minimum wage in my state and the price of everything went up on our menu by a $1 to compensate.. dumbo the clown."
"663","Check the number of pages. You #Dumbo"
"664","Guys I fell asleep during the movie dumbo and Lex goes “did you enjoy the movie, asshole” <U+0001F602><U+0001F602><U+0001F937><U+0001F3FB><U+200D><U+2640><U+FE0F>"
"665","||• The new Dumbo movie was absolutely the cutest!! <U+0001F495><U+0001F495>"
"666","can you believe i spent a whole 20 minutes of dumbo crying"
"667","I saw the movie and I am glad I did. While not a cinematic masterpiece, it is an honest look inside the Planned Parenthood clinics. It is not for the faint of the heart. Media is appalled by the depiction of brutal abortion procedures, but the act itself is OK, ""experts"" say so."
"668","@iKamranShahid @ppurva She is real Dumbo . She has no idea what UPSC is !"
"669","@BhavikaKapoor5 Yo dumbo, you are the one who is hallucinating from breathing your own farts. Get your head checked"
"670","Unpopular opinion. I really liked ‘Dumbo.’ It looked beautiful. That elephant was super cute and it left you rooting for the underdog the whole time."
"671","I'll pretty much subject myself to any sad movie ever, but this new dumbo movie, dawg... what kinda sick, masochistic shit would that be if I did that to myself #Dumbo #morelikedumbno"
"672","So Dumbo was definitely not supposed to be that good, but it was"
"673","Where the singing crows though?  <U+0001F401><U+0001F418>"
"674","I missed the singing crows. <U+0001F95C><U+0001F388><U+0001F921><U+0001F418>"
"675","im so sad dumbo isn’t supposed to be very good rip it looked so cute"
"676","@TheAVClub I see this Dumbo and just want to punch him in the face."
"677","@sianoresist I'd vote for Dumbo over Trump."
"678","I loved the movie dumbo so much <U+0001F62D><U+0001F97A>"
"679","I loved the song and the whole movie <U+0001F60D><U+0001F60D>"
"680","Jesus Christ, Tim Burton, when I said ""Dumbo, but I shit my pants out of fear"" during that last goth orgy, I was high off all that powdered crystal skull!"
"681","My fam went to go watch dumbo w out me. They’re fckn fake, I don’t claim them.<U+0001F92C><U+0001F624>"
"682","I have anxiety with open air rides that get just the slightest above ground fuck you. I could barely handle the fucking dumbo ride at Disneyland"
"683","@asheeka1 @AAMI @AbbottGlobal @ACSnewsfeed @ArrowfieldStud @AskDysonAU @auspost @BetEasy @BJTMarts @blinkist @bmwau @bookingcom @CocaColaAU @Coles @CommBank @Dumbo @Duracell @eBayAU @maccas Whilst a huge fan of her artistry I am continually impressed by Magda's intellectual engagement on a range of issues and her compassion she is certainly a standout woman."
"684","the year 2012 is a fuzzy wuzzy <U+264A> <U+0001F6B1> <U+0001F4E0> From the mind of a genius, -flippo the dumbo idiot"
"685","Hewwoof all, this hecking pupper would like to tell you all to PWEASE support trans rights and condemn all these white male shooters killing my fwens. Also consider donating tickets to Dumbo in theaters now to Muslim survivors of the New Zealand shooting! <U+0001F3F3><U+FE0F><U+200D><U+0001F308><U+0001F43E><U+262A><U+FE0F>"
"686","@JimF22003 @markknoller @POTUS He's showing compassion, which Dumbo Democrats lack, instead it's little girls, pedophilia! See Uncle Joe Biden!"
"687","Sarah loved the movie!! She even got the <U+0001F9F8> plush toy"
"688","Okay so I cried for the entirety of Dumbo"
"689","@jceastb I got called Dumbo and Ross Perot. I know your pain."
"690","All animals deserve freedom #animalliberation"
"691","@LilaGraceRose @UnplannedMovie @jack @LiveAction DUMBO"
"692","Of course I’m not going to see Dumbo! I don’t need a relapse in my postpartum depression!"
"693","Watched @Dumbo, next will be @ShazamMovie  and #PetSematary remake. Interesting week"
"694","Now that April Fools day is coming to the end I just want to say that I really don’t have a beef with this movie. I’m not interested in it but I think Dumbo himself looks kind of cute"
"695","Disney exec: what if Meg Murry but all the movies for now on"
"696","Cry counter: Dumbo

Balled 8 times"
"697",".@TrezaR probably has something to say about this"
"698","My friend: So did you like it!?! I LOVED IT. (Live action Dumbo)

Me: Well... (restrains all of the real life animal right issues it made me think of) maybe?"
"699","The reason why the live-action Beauty and the Beast did so well was because it reminded people of the 1991 classic.

Dumbo failed at the box office not only because it deviated too far from the original but because it failed to improve upon it."
"700","One of the films mentioned in this tweet is an original animated film and the other is a live-action remake of an animated film. Guess which one I'm looking forward to the most (don't let the names of the studios behind the films fool you into thinking I'm biased)."
"701","Next weekend me and Sarah are gonna go to the movies to see the best film ever made. It's about an elephant named #Dumbo and he reminds me a lot of Sarah and is as magical as her #ad"
"702","@GrahamAllen_1 @Alyssa_Milano @UnplannedMovie @Twitter ...and ""Dumbo"" is the #1 movie in America, with 7.5 times the revenue of ""Unplanned"". Does that mean America is 7.5 X more pro flying elephants? Even weirder, right?"
"703","Shout-out to my pal Alan “Randy” Jones (no longer on Twitter), who noted that Michael Keaton in Dumbo was basically channeling Roger Stone."
"704","DUMBO (Burton, 2019): Contains an absolutely horrifying late-period Johnny Depp-style performance by Michael Keaton. Movie would have been 500x better if he and Alan Arkin had switched places."
"705","Dumbo was... really good! It’s not just a shot-for-shot remake—the first act is a remake of the original movie (with a LOT of liberties) and the other two thirds of the movie are completely new. 

Not as good as the original, but by far the best of this recent string of remakes"
"706","Times  change  and  we  don't  need  this  type  of  entertainment  any longer.
Also  Hollywood  did  an  Excellent  job  of  making  Clowns  Creepy."
"707","The original Dumbo was a shit film hour-long film that had 20 minutes of bizarre racism in the middle. 

Tim Burton didn’t have much to work with."
"708","I love that there are people like this in the world."
"709","Adam Driver have a big ears, he’s basically a human Dumbo."
"710","So change of plans, instead of going to the game, I will be seeing Dumbo by myself and you will find me in the corner bawling my eyes out."
"711","Leftist culture in Hollywood is sick
Robbing our children of their childhood
Robbing them of God and Jesus
Teaching them all things macabre
They run scary horror movies
Right thru Christmas
Progam kids to expect the macabre
Taking away their innocence
thru programming 

#maga"
"712","@rachelfaith97 visuals were beautiful, Dumbo was very cute, most of the plot didn’t make sense and I literally cared about the dad and kids not at all lmao. Not terrible but not good either lol"
"713","@rachelfaith97 She took care of the horses in her dad’s absence! She actually has some background on how to train Dumbo and make him feel safe!"
"714","I can’t unsee this..."
"715","Child/animal abuse and exploitation in a movie for kids doesn’t do well?

Shocking."
"716","@smilingldsgirl So far all movies I've seen this year are soiled for me
1. Lego Movie 2
2. How To Train Your Dragon 3
3. Wonder Park (The Message Is Probably Why I'd Put It Here)
4. Dumbo 
5. Dogs Way Home
I enjoyed all of these for what they were unless you count norm 2 then that's garbage"
"717","Karen w/ the problematic parallels!"
"718","@JoTodd4 @BearRamblesOn @HillaryMonahan @Pocket_Cindy Damn, put in that context, “Dumbo” should be the name for the Disney studio executives instead of the little elephant!"
"719","@realDonaldTrump That is because the real report has not been released dumbo donny. Once the real report is released we can then see what is what."
"720","You should not see Dumbo if you have abandonment issues."
"721","When I saw they were doing this remake like the first thing I said was “I know they’re not gonna make me watch a live action version of Baby Mine” they HAD to have known that this was a bad idea"
"722","@themitchellfink @iheartmindy @LibertyJen 
She may not be Rambo, but you're certainly Dumbo."
"723","im about to see Us and in the theater lobby theres a big display for that horrible cgi dumbo movie and its filled with dumbo funko pops and plushes and god i just wanna burn it down"
"724","@blinkist
@bmwau
@bookingcom
@CocaColaAU
@Coles
@CommBank 
@Dumbo @WaltDisneyCo

Are u really ok with your brand supporting:

Hate speech
Racism
Misogyny
White Supremisists
One Nation
Abuse of free speech

No? Then stop funding it by advertising on @SkyNewsAust

@slpng_giants_oz"
"725","Sooo who’s gonna get me a really big dumbo stuffed toy? Im in luv"
"726","@realDonaldTrump Amateur trump is worse than incompetent politicians! Dumbo trump loves to bull<U+0001F4A9>"
"727","@realDonaldTrump And does dumbo trump have a plan? NOPE he hopes his GOP lackeys will do the hard work and get the credit or simply blame DEMs."
"728","@realDonaldTrump Good news for Dumbo trump’s E-score — overall strong NEGATIVE appeal is high !"
"729","If you tell me you don’t want to watch the live action dumbo <U+0001F418> you’re weird"
"730","I hella want to watch dumbo <U+0001F418>"
"731","I averted my eyes from the trailer, absolutely cannot watch."
"732","One of my favorite #bat species. I have a soft spot in my heart for the plecotine bats. What a beautiful animal. #mammals"
"733","dumbo is one of the cutest movies i’ve seen <U+0001F418>"
"734","Hard pass on this movie"
"735","||; I guess Dumbo is getting bad reviews but seriously every time I watch that trailer I cry so I’m still gonna see it."
