"","text"
"1472","I told Felisha that if she has a good day at school we’ll go see Dumbo tonight, a teacher saw me and said, you’re Felisha’s mom right? She is so cute. Have fun at Dumbo she won’t stop talking about it” <U+0001F602><U+0001F602>"
"1473","I just cried eight times during dumbo <U+0001F629> every single fucking time dumbo flew i cried my fucking eyes out omg"
"1474","Tim Burton’s #Dumbo is a cinemathic feast. Pure joy from start to end :”"
"1475","@dbroncos78087 Dumbo got an A- so it seems pretty acurrate to me."
"1476","now I regret throwing the old dumbo sticker in our room"
"1477","the photobook better have this on full display or i’m going over there and having a little talk with the creative director"
"1478","shes taking me out to watch the avengers and dumbo in a few weeks okie <U+0001F63F>"
"1479","Dumbo is in theaters ? <U+0001F633>"
"1480","rly embarrassing how im crying over seokjin n his dumbo pajamas rn"
"1481","omg i really want to see dumbo"
"1482","Protip: Take 5 shots of tequila before you see Dumbo"
"1483","From the Boxing Ring to ‘Dumbo’: Michael Buffer Is Still Ready to Rumble
You might not recognize his name, but you definitely recognize his voice. Michael Buffer came up with one of the most recognizable catchphrases in history and has continued cashing in since.
…"
"1484","@_AshleyBratcher And Dumbo is controversial? Let’s say this movie is the best movie ever, it’s still about a controversial topic and would be rated very highly by supporters and very lowly by people opposed to the message. This is a fact."
"1485","gun control did the beaver <U+0001F610> <U+0001F638> <U+0001F3A5> Like for a tbh and rate, -flippo the dumbo idiot"
"1486","Clearly you haven't seen how many of the movies recently produced have been pure propaganda."
"1487","I think this is actually my favourite version? Like I love them all but Jin wearing a Dumbo shirt is winning me over <U+0001F602>"
"1488","I'm completely devestated hhfgjjfygjgd I think my heart stopped beating"
"1489","@TyWebbBeTheBall Good call on the ears. Kids called me dumbo in elementary school."
"1490","I’m at the pictures again tonight and hoping that it doesn’t end early and with me vomiting in the garage this week. Tonight’s double bill is #Dumbo and #UsMovie again because even though it terrified me, I was in so much pain &amp; felt so ill, I want to watch it while alert"
"1491","but jin with his dumbo pajamas is the softest thing ever <U+0001F624><U+0001F624>"
"1492","DUMBO: cute elephant, fun DeVito/Keaton/Farrell performances, good pink elephants sequence, awful writing, bad story."
"1493","ireland who america really all is one more time, 
I have seen my chosen files independences and freedoms  and the bastard you all elected  Rushed into production largely because the studio needed an influx of cash, “Dumbo” is credited as a key player in saving Disney’s fortunes."
"1494","and fell off of the boat than a world war II surfurced and thats all really donald trump is a national security threats and each day off of a walt disney discover the top secret files out of the pentagon dumbo was the elephant movie about"
"1495","@KeithPowersNYC @nytimes 
in africa in 1941 do you know what dumbo meant I could assure you it wasn't the white people who brought it here, africa but in a faith out of the jewish and christian's all did 
tied them on ships like slaves and in a currents of waters many died"
"1496","Imaginitive yet lifeless. It's the best way to describe it."
"1497","@_AshleyBratcher @BrianKempGA @foxandfriends @ainsleyearhardt @UnplannedMovie # 2 Why in the world would you take a 8 year old child to see this horror film? Especially when you have the option to take them to see Dumbo. Stripping women of their rights and traumatizing the children, what is wrong with you people?"
"1498","@Alyssa_Day But there's no way in hell I'm going to see Dumbo. I've never recovered from the original."
"1499","We aren’t even at a Disney presentation, and the second ad in this first presentation at cinemacon is about @Dumbo and I have a real issue cos this elephant looks so cute."
"1500","@ErinaceusFrance Dumbo the hedgehog version <U+0001F60D>"
"1501","jin please post a selfie with your dumbo shirt i would like to see it"
"1502","@Alyssa_Milano @realDonaldTrump Your point being dumbo?  Maybe puerto rico must start holding their local leaders responsible and stop parasiting on other Americans."
"1503","Awwwwww dumbo and Jinnieee <U+0001F618><U+0001F618>"
"1504","@anoushasakoui @Dumbo I'm still flummoxed how Disney thought Tim Burton and cute elephant were a thing that went together, but here we are!"
"1505","The theaters should screen An Apology To Elephants before every showing of #Dumbo. Are we still glorifying circus animals?"
"1506","that dumbo shirt Im laughing KWKDK everyone looks so good and then u have seokjin in that outfit eye"
"1507","Also I defended Dumbo. No one needs her false negative reviews."
"1508","@realDonaldTrump Lying Treasonous Trump, they had only ""gotten"" 11 billion (I know, you can't count.) Also dumbo, Puerto Rico is part of the United States. #DUMBESTPRESIDENTEVER"
"1509","Too right, I cannot even think about Dumbo without crying <U+0001F62D>"
"1510","the Softest"
"1511","Off for a Disney date night to see @Dumbo at @vuecinemas in Cwmbran with @tammystacey85 #Dumbo #DumboMovie #disney #vue #cinema #cwmbran #date #night"
"1512","Also this means there will at least be one promotion where Jin wears his Dumbo shirt pajamas and vmin wear their lace right???"
"1513","Tomorrow we going <U+2708><U+FE0F> Dumbo and the day next <U+2708><U+FE0F> Us"
"1514","@vuecinemas I mean I just wanna watch dumbo tonight not avengers <U+0001F602><U+0001F937><U+0001F3FD><U+200D><U+2640><U+FE0F> Been sat in a que for an hour online which then paused... then I called and said my call will be answered in 60 minutes <U+0001F633><U+0001F92F> @cineworld it is"
"1515","Olai Uludong, Permanent representative from Palau to the UN steering the session now being called #CBTT as facilitator also reminding delegates of Dumbo the Octopus and the Albatross. They are listening. #BBNJ #UN @SOAlliance #Fair&amp;Equitable"
"1516","Olai Uludong, Permanent representative from Palau to the UN steering the session now being called #CBTT as facilitator also reminding delegates of Dumbo the Octopus and the Albatross. They bear witness. #BBNJ #UN @SOAlliance #Fair&amp;Equitable @PacOceanComm"
"1517","my desk neighbor has trash talked Dumbo to every fucking person that has called this office today

so now I have to go see it."
"1518","@graphicfighter Tons of pearls, balloons, roses, strawberries, cookies, snake bracelets, Chanel and Gucci, pink lipstick and pink shoes and Dumbo pajamas and empty bored eyes and fake smiles
Purposely sickly sweet &amp; vain
It's Persona, the mask of the soul, no?"
"1519","your parents are Mexicans you dumbo, they lived here they were born here...you’re just a Mexican descent, you don’t even try to understand what we’re trying to say, you use the fucking Mexican culture as an aesthetic and not as a whole, just what you like"
"1520","@OfThefireflies I spent at least 50% of #Dumbo crying - sad &amp; happy tears! It's such a gorgeous movie &amp; my favourite Burton film since Big Fish. Dumbo is the absolute cutest &amp; they did an amazing job of recreating that adorable cartoon elephant, you could see every emotion in those big blue eyes"
"1521","be careful dumbo quite person notice everythinggggg"
"1522","@LegendsPsl @DennisCricket_ Spot fixing and ball tempering are two different things dumbo"
"1523","@realDonaldTrump Great! Can we get a legitimate president instead of dumbo?"
"1524","who wants to go watch Dumbo?

asking for a friend I promise<U+0001F92B><U+0001F60A>"
"1525","Which #boxoffice film are you paying to watch this weekend? 

<U+0001F3A5> #Shazam  <U+0001F39E> #Dumbo  <U+0001F3AC> #UnPlanned #UnPlannedMovie"
"1526","I literally watched dumbo with my sister last week"
"1527","- Ima kid all over aqain <U+0001F923> seeing @Dumbo <U+2764><U+0001F418>"
"1528","Taking the afternoon off to see @Dumbo at @cineworld Sheffield with @OMGitsLouiseee. 

First — faces stuffed."
"1529","Dear Ashutosh,

You have proven yourself to be a Dumbo.

Better clear up your ideas."
"1530","Repost for $5 and working wit budgets on features hit me today
I’m tryna go watch dumbo and not use my moneys lol"
"1531","@Under6ftNoBeard dumbo probably gonna make its profits overseas"
"1532","@yolsilis Yet I'm trying to see Dumbo today and have to deal with this fiasco. Come @AMCHelps my A-list isn't working. Do I have to go to a physical theatre to get tickets like a peasant."
"1533","Gujarat riots comes in 1947 riots category played by Thanks to Nehru... Sikh genocide and Kashmiri Pandit exodus was @INCIndia welfare scheme.. @shuklapinku @RahulGandhi @priyankagandhi.. Dumbo pidi"
"1534","#VeryMeRewards private screening of dumbo I would take wendy and her boys, Jane, Suzy and her girls, my girls obviously and some school friends."
"1535","Jin and dragonfly or Jin and Dumbo"
"1536","the PJs jin is wearing have a dumbo on the butt cheek can he turn around im tryna see sumn <U+0001F441>"
"1537","@blakers_66 We are seeing dumbo before you go see that!!!!"
"1538","@CineplexMovies can we check movie times anywhere else. Was planning on taking my son to see dumbo today."
"1539","Ughhh was planning on taking my son early out of school to go see dumbo but I can’t see the movie times <U+0001F629>"
"1540","All I gotta do now is actually watch the new Dumbo."
"1541","did the dumbo pajamas sell out already im counting on you bangwools"
"1542","Ok I still need to watch Captain Marvel and Dumbo"
"1543","im with the dumbo pajamas guy"
"1544","@jeonly_ @Ninabtsjk lmao I was a bit late with seeing the concept photos but as soon as I saw dumbo it just fit so much and i love dumbo <U+0001F62D><U+0001F62D>"
"1545","@yugyurts OH MY GODDDDDD CAN HE PLS TURN AROUND i need a picture of his dumbo butt please seokjin its for Science"
"1546","@StrikingPatriot @ThisIsMyMJ Dumbo became a flop because of budget, not because people didn't went to see it. It will still make around 400 million. Lion King will definitely make 1 billion+"
"1547","@jonathancovey In the case of Dumbo, though, they had to excise the inherent racism and recutting the cartoon was impossible"
"1548","Me after before and after watching dumbo"
"1549","Me before and after watching dumbo"
"1550","@nctyuhta that’s not how you supposed to respond.. dumbo <U+0001F60D>"
"1551","Yes turd I'm sexy and I know it."
"1552","@jothims @RahulGandhi Foolish dumbo is papu, neet was created by congress and to beg vote this liar is keep on rocking with fake manifesto"
"1553","@JL_Kdiamond @BTS_twt I like #Dumbo ... I use that a lott to the people whom I love ... Yes we can def use that for our Disney prince #JIN  and it fits so well ! <U+0001F602> <U+0001F495><U+0001F495><U+0001F60D><U+0001F60D><U+0001F60D>"
"1554","Is it just me or i can picture how bts reaction towards this is by grabbing jins ass"
"1555","@IamRah I'm also about to do my 3rd round of PRP microneedling and i actually got that done at a black owned med spa in Dumbo named Resilience Med Spa.  They have a deal on Groupon it's done wonders for my skin"
"1556","Dumbo’s foreign origins and his semiotic “blackness” posed a marketing challenge. After seeing Fantasia and Pinocchio tank at the box office, it needed a financial win, badly. And there was a war on that had something to do with the persecution of Jews and circus people."
"1557","By contrast, the ears of African elephants are larger and higher up on the head. Taxonomically speaking, Dumbo is an African elephant. (Light begins to dawn)."
"1558","Why would Disney make Dumbo and his mom albino without literally making them white? Because snow-white elephants would explicitly raise the topic of race, whereas Dumbo prefers to keep that theme at the contestable level of subtext."
"1559","In 1941, when the first animated version appeared of #Dumbo appeared,  critics consistently noted that the baby elephant had blue eyes. And that there was something, hmmm, odd about them."
"1560","In the movie theater getting ready to watch Dumbo! #Dumbo"
"1561","Bring the whole family to see Dumbo, tonight, for just $5 each!  6:55 pm."
"1562","Who it's ironic how Dumbo a movie about corporate greed was remade only to make money. It's an orwellian self fulfilling prophecy"
"1563","I see no one hyping Version 3 but I would die for Jin's Dumbo Panama's OKAY"
"1564","@ashutosh83B @narendramodi @RahulGandhi You Dumbo..... 
JFK - Political assassination 
Martin Lt King - Same
Anwar Sadat- Same
Gandhi - Same

Please read dictionary and understand the difference between assassination and terrorism... Godse did not terrorise Gandhi or any other man. He just shot him dead due to ideology"
"1565","i watched Dumbo today and i’m still crying, i love that little elephant so much, bless his soul <U+0001F62D><U+2764><U+FE0F>"
"1566","Last week:
Disney's Live Action Dumbo (dir. Tim Burton)
What We Do in the Shadows
XU 80th Commencement Exercises

This week:
April Fools
Veep S07
DC's Legends of Tomorrow

Shazam! (The other and the original Captain Marvel from DC Comics/Fawcett)

Cloak and Dagger S02 -2d"
"1567","@bainjal @narendramodi Y the bell is Godse a terrorist u dumbo<U+0001F914><U+0001F914>"
"1568","@bainjal @narendramodi Y the hell is Godse a terrorist u dumbo?? <U+0001F914><U+0001F914>"
"1569","and dumbo tooo??? one of my fave disney movue!??!?!? can you give me a REST. my hearts been pounding: HARD.."
"1570","Bring the whole family to see Dumbo, tonight, for just $5 each!  6:45 pm."
"1571","I'm off to watch Dumbo in the cinema with the mrs so will be offline <U+0001F602>

Probably miss the United match too <U+0001F92E>

Laters!"
"1572","Everyone thinks Jin in the Dumbo shirt is so cute but I just get sad bc Dumbo is the saddest movie I always cried as a child :(("
"1573","@sekere_111 @benmurraybruce @officialEFCC Is he a governor?  Or have you been to his constituency to see the number of school he has renovated via constituency project ? Talking about silver bird do u know how many people he employed what hv d dumb govt done more than (traded money) ? Think B4 u talk dumbo"
"1574","@ndtv @LRC_NDTV 100 out of 100 are concerned about scams @PChidambaram_IN .

Beat that dumbo!!"
"1575","Jin with dumbo pjs <U+0001F614><U+0001F614><U+0001F614><U+0001F614><U+0001F614>"
"1576","@blackvelvetsun Gonna go out on a limb and say that I actually like him. Edward Scissorhands, Sweeney Todd, Corpse Bride, Beetlejuice, and Big Fish are some of my favorites. That being said, Dumbo was trash."
"1577","Dumbo is such a great film! Absolutely balled my eyes out<U+0001F62D><U+0001F497>"
"1578","I saw Dumbo and I'm afraid Tim Burton flew too close to the sun. It was dry and boring. We watched the original the night before, and was disappointed with his that story was shoehorned into the first 20 minutes. Dumbo seemed to be shunted to the side more often than not. C-."
"1579","@RulerOfEstonia No, I also don't know when things or happening. Is Dumbo in theaters yet? Can I go see Colin Farrell's latest undercut in peace"
"1580","Eva Green with Dumbo and the kids in #Dumbo was the cutest thing to watch"
"1581","I’m going to see Dumbo tonight and I’m so excited <U+0001F483><U+0001F3FB>"
"1582","Shit I still get tripped out during this scene"
"1583","#AvengersEndgametickets are on sale and it crashed the AMC app. Feel bad for the person who just wanted to buy their Tuesday matinee tickets for #Dumbo"
"1584","Howling Kayleigh went into primark to get her mum some wee tops n literally everything was ‘you do you babe’ or fucking dumbo <U+0001F923><U+0001F923><U+0001F923><U+0001F923>"
"1585","@MomentsIndia Such an antinationalsit manifesto..gosh..I just know that will not vote you, u dumbo n deshdrohi..!!!! NamoAgain"
"1586","this is literally me right now"
"1587","Not to be annoying or anything but I could literally care less about The Avengers &amp; @AMCTheatres is now down and i don’t have access to my tickets for #Dumbo tonight!!!!!!!!!!!"
"1588","One of my friends wants me to go and see dumbo with her tonight but I have and essay due tomorrow that I haven’t started and I wanna try to finish the last article for this Friday’s exam and she’s insisting so bad hOW DO I MAKE HER UNDERSTAND?"
"1589","@vxmpire Man is wearing a 3000aed Dumbo pj <U+0001F614>"
"1590","@AMIT_GUJJU Last level of Dumbo, dimwit, high on weed, imbecile..... Moron"
"1591","@joshgad Quit being a follower. Go see Dumbo. Apparently the elephant kills the whole circus and they have to go back in time to get Peter Pan to save them. I feel like I've mixed up the plot a little."
"1592","jin’s dumbo pajamas are everything"
"1593","I love dumbo even tho there's this one part during its bubble bath that was so fcking trippy and it scared tf out of me when i was a kid"
"1594","@maljutley @Dumbo #Animation #AnimatedMovies.  @WaltDisneyCo Some of these visuals for the new #Dumbo film release are strong enough for YOUR flagship company level. I'm just saying! <U+0001F412>"
"1595","Me , Carley &amp; Asia going to see Dumbo later ."
"1596","Maybe i i can never flyyyyyy"
"1597","@journalnews Hopefully Franklin PD for their sneaking shows on cause Dumbo here could hear them coming from a mile away."
"1598","pleaseeeee necesito ver Dumbo"
"1599","I’m going to go see dumbo and if it’s not good I’m beating Michelle’s ass"
"1600","Just saw Dumbo and it did hit me in the feels. This was always a very sad dark story and I actually really enjoyed it. It is a slow paced movie but with a lot of heart and beautiful scenography as Tim has us used to."
"1601","This goes great with Tame Impala’s “Elephant”"
"1602","@Lopez_gusbus In off at 530 and I’m trying to see dumbo <U+0001F60E>"
"1603","Andy Serkis was not is The Greatest Showman or Dumbo because he’s anti-circus"
"1604","@BJP4India Yeah because u don't have family holidays are a must dumbo"
"1605","@simfelemy @cineworld PUT SOME GOD DAMN RESPECT ON BEN’S NAME!! I literally just tried buying Dumbo tickets for tonight and that’s not even working hahahah SHAMBLES"
"1606","I want to watch Dumbo next Wednesday but can't find the times because my cinema's website keeps crashing because of bloody Avengers tickets <U+0001F643>"
"1607","soooo <U+2665><U+FE0F> to watch dumbo with me beeecaauussse it’s like 5 dollars at the theater in poky and i’ve been trynna watch dumbo since it came out"
"1608","For real though! Some things should just be left alone. <U+0001F633>"
"1609","u are hurting me this is so painful hala"
"1610","the baby boy jumped out"
"1611","Give the latest podcast a listen for all things Dumbo and Tim Burton related"
"1612","I need him to turn around so I can see the pockets"
"1613","@RockTheReddd @DeeJensen74 @EFEvans3 @ChatByCC They're still citizens dumbo. Same as Washington DC residents."
"1614","Someone come watch Dumbo with me"
"1615","Off to see dumbo tonight <U+0001F418><U+0001F418>"
"1616","@BlueRobotDesign @realDonaldTrump Whatever dumbo. I guess you would rather have a Socialist state run by the Left."
"1617","These days, instead of watching films like Us and Pet Sematary, I'm watching Dumbo and Wonder Park. Not that there's anything wrong with that. Both movies still grapple with mortality and the darkness inside humanity, but ..."
"1618","@realDonaldTrump Are you even aware that Puerto Rico IS a  territory of the United States .  You ain’t too bright Dumbo"
"1619","a baby a literal baby"
"1620","@MrsGandhi @RahulGandhi Accuse him of whatever still dumbo will sing Rafael only <U+0001F602>"
"1621","Ditched a family birthday meal to go and watch Dumbo, sorry but there is priorities"
"1622","about to see Dumbo with the twins and I guarantee one of us will come out crying...me it will definitely just be me."
"1623","please i  rmbr this animation so well m:("
"1624","It’s so evident that Kids <U+0001F46B> holidays have started ... #Dumbo <U+0001F418> Tamil3D is performing very well !!!"
"1625","I love cartoon dumbo but this one looks pretty cool <U+0001F631>"
"1626","this is so cute"
"1627","Mayra and I be like"
"1628","It's the latest episode of CRITICALLY ACCLAIMED! Can you dig it?"
"1629","so I just watched dumbo in the cinema and I was a crying mess"
"1630","Dumbo 2019 — this is bad. Like real bad. Apart from Danny DeVito and Colin Farrell the performances are weird or awful, Eva Greens forever changing accent puts you off every scene she’s in. The film also makes poorly constructed references to the original."
"1631","my most recent one is definitely when we saw dumbo this week. When Michael Keaton stepped out of his fancy car for the first time, the little 4 year old girl sitting in front of us went “YES!!!!” And clapped as loudly as she could."
"1632","If you think Dumbo doesn’t kill people you’re living in a dream world"
"1633","Ready to sob in this movie theater seeing #Dumbo"
"1634","@Justinecurran7 I can’t watch the new dumbo. I just don’t feel it. I love the original cartoon"
"1635","I need someone to come watch dumbo with me"
"1636","@lilmisssmileen If I could find a picture of a ladybug dressed as Dumbo I could’ve said “Dumbó-ín Dé”, which works on many levels, but I don’t think they make costumes that small!!"
"1637","With the release of Dumbo I am hoping that millions of people around the world will stop, think, and support the work of charities and governments who are trying to reverse the impending extinction of elephant #SavetheElephants"
"1638","Just watched Dumbo with my sister and wow that was intense <U+0001F923>"
"1639","@RoyalstonDesign @ElCapitanThtre @PosterPosse @Dumbo @DisneyStudios Thank you! Really really happy about this. <U+2764><U+FE0F>"
"1640","@ShalompeaceBTS Dumbo and Jin. <U+0001F49C><U+0001F49C>"
"1641","Watching the new Dumbo movie on a Monday night while on my period may not have been the best idea <U+0001F62D>"
"1642","DUMBO:
""An elephant who is cruelly nicknamed ""Dumbo"", as in ""dumb"". He is ridiculed for his big ears, but in fact he is capable of flying by using his ears as wings.""

#BTS #PersonaPhotos"
"1643","@choi_bts2 @BTS_twt When I see Jin with Dumbo, why Awake lyrics come to my mind????!!!

""Maybe I, I can never fly..."" 

@BTS_twt"
"1644","@RepSeanDuffy Where The F**k is this crazy crap coming from? Actually it's playing to the beyond dumbo trumpie magats."
"1645","Dumbo drops an f-bomb in the new movie"
"1646","@Imamofpeace Only a dumbo like u could hv come 2 this conclusion, as if all those coerced conversions by Christian missionaries in Africa &amp; Asia wasn't enough 4 u?"
"1647","Going to see my first live action disney movie Dumbo. With my nana...."
"1648","@HealingMB Was that when he was trying to get the part of Dumbo?"
"1649","@kavita_tewari @VandanaJayrajan Chill Kavi.... Why do you believe this dumbo is coming to power. <U+0001F914><U+0001F914>"
"1650","@dhruv_rathee Now, show me one law which is not misused. Absolute dumbo you are. No wonder you support kejriwal"
"1651","I really love it when cheap copycat movies come out at places like Redbox. Can’t wait to see Pet Graveyard (Pet Semetary), Jumbo (Dumbo), &amp; The Yeti Adventures (SmallFoot)."
"1652","@Sm0kal0ke You do you! I want to see Dumbo and great show to binge on. <U+0001F60A><U+0001F60E> Happy riding!"
"1653","I agree with you Mr. Cox, with the dumbo crats it’s always about them."
"1654","i bet dumbo’s big ears would be delicious if they were battered and deep fried"
"1655","Can’t wait to see this today with my chicas!! <U+0001F49B>"
"1656","@LastMariposa52 @monogustd @BTS_twt Yup except when drunk dumbo happens <U+0001F600>"
"1657","i heard it's the year's biggest flop and completely excruciating, just as i predicted"
"1658","Dumbo to start my April!!! Never disliked a Tim Burton film <U+0001F5A4><U+0001F418> Hit me right in the feels with Dumbo and Momma Jumboooo <U+0001F62D>"
"1659","This week on Cinemaholics, I took over hosting duties while @JonNegroni was away. And thankfully, I was joined by my good friend @CoryWoodroof47 as we discussed DUMBO and THE BEACH BUM in an episode that I think can charitably be described as ""a bit unfocused."""
"1660","If you haven’t seen Dumbo go see it. The perspective of a mother and son love(animal version), is what makes it so much better. I don’t think I ever cried so much until I saw Dumbo."
"1661","Hey @AMCHelps can you please place a hold on seats H7 &amp; H8 at the Disney Springs AMC for the 7pm Dolby showing of #Dumbo I can’t get to the theatre until closer to show time and I can’t get your website to work."
"1662","I liked the dumbo &amp; lion king remake idea but when i saw aladdin with will smith and dora movies.... oh Disney why?... WHY?"
"1663","This is called as loyalty which is earned, not won by Jumlas. The dumbo BJPee chuddies never gonna understand this..Becz disloyalty is in their blood deep inside..Don't believe me ? ? .Ask Savarkar<U+0001F923><U+0001F923><U+0001F923>"
"1664","I just want to go out and see the movie dumbo <U+0001F418><U+0001F62D>"
"1665","@Thatgay50023658 @alexmorgan13 How about you show your social security record! DUMBO the DUMBASS"
"1666","Not even half way through Dumbo and I’m beefing already<U+0001F63F><U+0001F63F><U+0001F63F>"
"1667","Just for the record, this same Tweet applies to Dumbo. ELEPHANTS ARE PERFECT AND I LOVE THEM."
"1668","Are you seriously telling me I couldn’t access my @AMCTheatres app to reserve my seats for Dumbo because of an Avengers movie <U+0001F644>"
"1669","Tell me about it. I heard the ""Baby of Mine"" song on a commercial for diapers and started weeping."
"1670","I’m watching the cinema sins of dumbo and I STILL cried during the 2 seconds they showed of baby mine"
