"","text"
"1105","Dumbo made me into a crying mess, and the little boy crying out “poor baby elephant” in the front row was not helping. He made me want to cry more because I could feel his hurt<U+0001F62D><U+0001F62D><U+0001F62D>"
"1106","After screening #Dumbo, I'm (even further) convinced we should put Colin Farrell in everything, and also, there is pretty much never a scenario in which I would not still be attracted to him."
"1107","@_AshleyBratcher @unplanned That’s actually twice in 4 days that you beat Dumbo! <U+0001F602>"
"1108","@_AshleyBratcher @unplanned I heard you beat out Dumbo... congratulations! <U+0001F44F><U+0001F44F><U+0001F44F>"
"1109","#Dumbo was a delight - not narratively out of the box but what it was it did well and tugged at the heartstrings with unexpected authenticity"
"1110","@SharLivingstone Haha yeah the painted arrows aren’t very popular ... it’s been wonderful - #TheLegoMovie2 was fabulously colourful and funny and #Dumbo looks great ... perfect de-stressor <U+0001F600>"
"1111","She's definitely one of the worst parts about the movie, and that really is the entirety of her character.  The cringy nature of it, along with her horribly wooden acting, is painful."
"1112","Not to mention what we know about circuses as adults that we didn’t as a child? Traumatizing.  No way I am seeing this. 

PS: Good fiction read:Water for Elephants."
"1113","True. I can’t handle seeing animals sad or abused. The trailer alone had me all <U+0001F622><U+0001F622><U+0001F622><U+0001F622>"
"1114","@KegMinami @_Unexpectables_ ""In this week's episode of The Unexpectables, Kiwi the Kenku will be portrayed by Danny Devito.""
&gt;""I have an unquenchable thirst for human blood. Which I will collect with this knife.""
""Danny, that's not in the scri— OH GOD!""
&gt;""Fuck you, Dave, I was in Dumbo. LET ME HAVE THIS."""
"1115","@DisneyStudios @jeremy_pailler @LST_MIND @AdStothard These are beautiful. I had to pick my melting heart up off the floor at the theater tonight. <U+0001F62D><U+0001F60D> #Dumbo<U+2060> <U+2060> #TimBurton <U+0001F44F><U+0001F3FB> #3D"
"1116","More on @Dumbo: Liked it a lot. Charming, but with the right amount of dark. BUT TOO LONG! New @undeadpaulbales rule: 90% of movies should be 90 minutes long. 100% of kids movies should be &lt; 90 minutes long. @theasylumcc movies, 4 minutes long.."
"1117","@Frankenberger @Dumbo @theasylumcc They don’t. Something like 40 mins in my daughter was bored. “Why?” I asked. She replied “Dumbo hasn’t flown and there are no good girl characters.”"
"1118","Eva Green was the greatest human star in Dumbo. She is better as a heroine than a villainess. When she was first introduced to the audience, it was hard to discern which one she really was."
"1119","Dumbo is such a good movie seriously, I used to hate the animation version but the new one is just so freaking god omg"
"1120","Just once, I'd like to see a box office metaphor that has absolutely nothing to do with the movie--""Dumbo fails to cast spells opening weekend"""
"1121","sorry but I never actually watched dumbo as a kid. and now that i’m a grown up and i’ve seen parts of it at my job I’m realizing I still don’t want to watch it bc the parts where they’re mean to him make me upset"
"1122","i’m 5 min into watching the new dumbo movie and i’m already crying"
"1123","Idk if my grandfather was Mussolini I'd personally disown myself from the family myself. Dumbo"
"1124","There’s a movie called “Dumbo” about a flying elephant (which we know doesn’t exist) that people have paid to go watch. Who’s really the dumb one?"
"1125","@undeadpaulbales @Dumbo @theasylumcc But yes, I'm joking, we find out how long a film is the same time everyone else does.  Though sometimes it's wrong and results in pure chaos...such as Skyfall running 10min longer and my old boss only putting 20min between shows - that wasn't fun weekend."
"1126","@undeadpaulbales @Dumbo @theasylumcc This rule doesn't bode well for Toy Story 4's David Lean sized 3.5hr runtime with intermission."
"1127","@undeadpaulbales @Dumbo @theasylumcc I dunno, in my day job I'm a theater deputy general manager making show schedules... ;)"
"1128","@undeadpaulbales @Frankenberger @Dumbo @theasylumcc A smart kid who knows what she likes.  40min in and no flight!?  Wow, jeez that's bad.  I don't expect him to fly minute 1 but at least a small jaunt from one side of a room to the other.

I'm damn curious of all the children itching for AVENGERS ENDGAME; but it runs for 3hrs."
"1129","wanted to fight the whole movie....i forgot why i never watched it more than once as a kid."
"1130","shazam is coming out this week
pet semetary is coming out this week.
dumbo came out last week and captain marvel just came out but watch US still get all of them the fuck outta here."
"1131","I'm back. Thanks for indulging my OJ and Dumbo tweets for a day.

Apologies to the people who unfollowed me."
"1132","Danny Elfman sure outdid himself with the Dumbo soundtrack. Such amazingly nuanced &amp; soulful motifs, playful orchestrations, and interwoven melodies of complexity, depth, &amp; joy."
"1133","The New Dumbo live action movie, but Dumbo is played by Danny Devito."
"1134","He won’t sit still through dumbo lol especially because it’s like real life. Only if it has iron man he will sit still <U+0001F602>"
"1135","Just watched Dumbo.  As good as the original but with real people."
"1136","@marcorubio @dcabellor @jguaido News from #LittleMarcoDumbo tonight:

In an effort to distract idiots who follows him, Marco Dumbo will compose fake News! And promote fake #oil puppet like @jguaido ! If Guaido is president, then I declare myself the interim president of the United States!"
"1137","@priyankac19 @AMISHDEVGAN Its galling how these idiots shamelessly peddle fake news that just need a google search to dismiss.. And she is calling this a fact check.. Lol.. She thinks the voters are stupid? The joke is on you and your dumbo Raga.."
"1138","The movie’s $6,110,000 weekend box office ranked the fifth highest total in the nation, acc to data rel by Box Office Mojo. Per theater, Unplanned averaged $5,770, beating Captain Marvel ($5,144) and topped only by Dumbo ($10,566) and Us ($8,978) among the top 25 in total revenue"
"1139","I saw dumbo and I cried so much <U+0001F611>  but now matter how different you may be, when you believe you can rise above it all <U+0001F603>"
"1140","Absolutely agree. Was brainwashed with these Christian propaganda films as a kid and I’m lucky to have a clear head now."
"1141","I sooo wanted to watch dumbo but these kiddos want captain marvel. So captain marvel it is <U+0001F64C><U+0001F3FB>"
"1142","Han laying down the truth once again."
"1143","I want to go see #Dumbo again, but I might just have a mental breakdown if I do"
"1144","@KarelyTorres1  high?"
"1145","Why is this so cute"
"1146","@seshanm @sekhar_shukla @mani1972ias @Payal_Rohatgi @PMOIndia @BJP4India @RSSorg @DelhiPolice @MumbaiPolice @BlrCityPolice @SpokespersonECI @CyberDost Oh dumbo... She said ask them to leave ... Didn't said do what they did with Kashmiri pandits. N if using word eviction is that dangerous then why don't u file case against those who actually evicted Kashmiri pandits? Ask them to evict n evicting sm1 forcefully is different."
"1147","Still on the fence about watching Dumbo"
"1148","Raise your hands if you cried your eyeballs off watching @Dumbo !!!

<U+0001F64B><U+0001F64B>

My heart melted looking into his eyes <U+0001F60D>

#Dumbo
#cutestthingever"
"1149","The new dumbo movie is very cute btw"
"1150","@HillaryMonahan @bellagoth I have no desire to see Dumbo, and I would not see a Bambi movie, either."
"1151","@SupTheGamer @urielappel @KINGDOMHEARTS @Dumbo I never used her once in a boss. It always felt cheap"
"1152","@rac80 @JulieReichwein1 @BreitbartNews Going to see Unplanned tommorow. Not interested in Dumbo."
"1153","@HillaryMonahan Both my kids refused Dumbo as a birthday movie, told us they would also not subject ANY of their friends to ""a movie that looks really sad"".

During a different movie, the family next to me (4 kids!) shouted at the Dumbo trailer, telling their dad ""Don't make us watch that!"""
"1154","@HillaryMonahan It hurts my soul to this day, that movie. On my one and only childhood trip to Disney a Dumbo stuffie was the big thing I spent my money on. I needed him to be safe with me."
"1155","irene going to watch dumbo, a children’s movie, late on monday night, in the cinema reveluvs prepared the birthday event for her is so precious like she actually went to check it out because we keep calling her dumbo"
"1156","bitches really went to the circus to make fun of dumbo like the great depression wasn’t about to hit?? rude motherfuckers go to the bank and check your stocks. that big ear baby has more job security than you you piece of shit!!!"
"1157","@TheAVClub That's because CGI Dumbo is creepy AF."
"1158","That is when you’re not being paid by Disney to pretend that dogs give a fuck about dumbo"
"1159","@rozwelI @undeadpaulbales @Dumbo @theasylumcc I'm sure a lot of porn is longer, but most viewers just skip to the good parts. I know I do."
"1160","@undeadpaulbales @Dumbo @theasylumcc Surprised to see children's movies that long, you wouldn't think that kids had an attention span to deal with a movie over 90 mins"
"1161","BAMBI
DUMBO 
CHARLOTTE'S WEB

that's why i fuckig despise Walt Disney and i refuse to visit Disney World and Disneyland

when you ask, WHO HURT YOU? i'll scream back, FUCKING WALT DISNEY, THAT'S WHO!!! 

i hope they lose billions with all the live action crap remakes. fuck'em."
"1162","Elephants on acid"
"1163","Legit would never inflict that movie on a child. Ever."
"1164","modern movie dumbo kinda look like the product of incest....."
"1165","Federico and Francisco used to watch Dumbo together now and there’s no more discussion on this headcanon bc it’s beautiful."
"1166","@ManaByte So are they live in S Cali or not and how does el captain work all i see is dumbo and penguins?"
"1167","I have a feeling I might end up really liking Burton’s Dumbo, but it’s not like he does the vis dev for his films: what I actually like is Burton’s taste in art directors, not his directing per se."
"1168","And suddenly because of this and dumbo movie i feel in love woth elephants."
"1169","Yes... but @Dumbo is lovely - so not all bad."
"1170","@Shiffa_ZY Who says Sindh is in ruins ,it is may be your desire but Sindh always prove its collective wisdom in every general elections .not Dumbo like islama.....bad."
"1171","I am still too shaken up from watching the Disney animated Dumbo as a kid so no way I'm going to watch the Live action version. Don't know why Disney thought it was a good idea. Of course it isn't doing well at the box office. Also they better leave Bambi alone."
"1172","The original also included “jive talkin” black crows...so there’s that"
"1173","The accuracy! <U+0001F629>"
"1174","@NadiaLayne_ @HillaryMonahan I feel like no one really LOVED the original movie Dumbo, even the name is triggering. Bad remake choice, what’s next Bambi?"
"1175","@HaleighFoutch @thaddwilliams, Haleigh and I are doing a re-review for Dumbo tomorrow. @ColliderVideo got it wrong the first time."
"1176","@TheNelGOD Lovely! Especially lil Dumbo's reaction."
"1177","So I guess I'm team #Dumbo? Honestly, no one's more surprised than me."
"1178","So here we are on a Tuesday night and I guess I'm team #Dumbo? Honestly, no one's more surprised than me."
"1179","From his great grandfather the head honcho of gandi parivar began building smart cities all over India. The cities have not attained any smartness but the people of India have become SMART<U+0001F602><U+0001F602><U+0001F602>"
"1180","13 minutes into the new #dumbo movie #dumbo just fuckin explodes and dies on an oil tanker 57 miles off the coast #ad"
"1181","I absolutely LOVED Dumbo!!!  The look of the movie was so cool and the story is great!  @Dumbo @Disney #DumboMovie"
"1182","Why is Dumbo flying making me cry <U+0001F62D> Aw precious x"
"1183","If these Dumbo party come to power again. They will push us to 7th century."
"1184","#Dumbo<U+2060> <U+2060>is hands down my favourite live action Disney film!"
"1185","@Dumbo is such a cute, loveable movie. I laughed &amp; cried. The way #TimBurton made #Dumbo come alive was amazing, so much so I'd love my own Dumbo. He touched every bit of my heart!! I'm still singing #babymine. It is definitely worth seeing, think I might go again! @Disney <U+0001F418><U+0001F3AA><U+2665>"
"1186","@KingdokCAN That second one sounds vaguely familiar and like something some internet dumbo might do..."
"1187","i dont care what the reviews are ill see dumbo for that arcade fire cover of Baby Mine"
"1188","I

Just

Oh, this isn't actual account!

Which makes sense cause I blocked that one"
"1189","If you’re trying to cry at least twice during a movie, go see #Dumbo!! Such a good film! <U+0001F418><U+0001F3AA>"
"1190","they really thought dumbo would be a box office smash?"
"1191","@UnicornRaidBoss Yeah right. Next you’re going to tell me this dumbo challenged another online personality (remember the beef?) to a real boxing match, then have it on PPV where you make millions, only to have the fight be a joke and basically a scam. 

This kind of stuff doesn’t happen Tani!"
"1192","@FilmCritHULK That episode was given a Genesis Award from the Humane Society for Outstanding Children’s Programming. 

It’s a trigger of mine, along with Dumbo. A completely necessary, utterly heartbreaking story. The amount of sensitivity given to Appa as a character- why I love the show."
"1193","@Dumbo Was that boy in the audience holding a Pooh Bear, or was it just a normal teddy bear?"
"1194","#BADLA remains unaffected by new releases - Junglee, Dumbo &amp; Notebook,  collects <U+20B9>70 lakh on 4th Friday!
Week 4 - Friday - <U+20B9>70 lakh
Week 1 - <U+20B9>38 Crore 
Week 2 - <U+20B9>29.32 Crore 
Week 3 - <U+20B9>11.12 Crore 
Total - <U+20B9>79.14 Crore 
@RedChilliesEnt @iAmAzure"
"1195","And I'm here. Getting emotional over the original dumbo's movie soundtrack..."
"1196","bambi/dumbo both had me on 1 as a lil girl 

dad still tells story abt taking me to bambi in the theater, &amp; bambi momma got shot, i screamed, &amp; he had to take me out  

to this day never watched whole movie"
"1197","Been sitting at @AMCTheatres for now 30 min to see Dumbo but the screen  has been dark this entire time... instead of refunding me how bout you let me have priority to get End Game tickets tomorrow and you’re out literally NO MONEy and I’ll have 8tickets  purchased ;)"
"1198","But I will do one after my check up therapy appointment with my therapist cause I will be seeing the @Dumbo movie with my mom and sister after its been years since she seen a movie with us after a lot of surgeries so I will do 2 movie reviews<U+2764><U+0001F3AC><U+0001F3A5><U+0001F4F9><U+0001F3AD><U+0001F4BB><U+2328><U+0001F5B1><U+0001F4F2><U+0001F4F1>"
"1199","#Dumbo is my fav live action Disney movie of all time"
"1200","Seeing #dumbo last night all could think of was teddy, they both need to grow into their ears <U+0001F602><U+0001F602><U+0001F602><U+0001F602>"
"1201","I’ve never even seen the original, so there’s that..."
"1202","Traits on TV, and that's why #RepresentationMatters in the media, maybe if I had seen people that looked like me I would have found how fucking beautiful I was and being a lot more confident in school, both with my looks and smarts, cuz when you call someone Dumbo"
"1203","And that my features made me beautiful, hot, sexy, and handsome, yes my big ears now are part of how Fucking handsome I am, and while watching #Dumbo I felt represented, yes In Dumbo I saw myself"
"1204","You are not calling them smart, and fuck I am both smart and beautiful, thank you #Dumbo I fucking feel you"
"1205","It's not that Dumbo feels ugly, but he does feel alone, as I once did, and watching this elephant overcome his insecurities, and flying makes me look back in my life and see how strong I am, yes it weird I felt this with an elephant, but I guess I never see people with my"
"1206","DUMBO IS THE CUTEST 
i cried 99% of the time <U+0001F927>"
"1207","We're watching ""Us"" &amp; when the preview for pet sematary came on nilo leaned over and said ""we should've watched dumbo"" <U+0001F602><U+0001F602><U+0001F602><U+0001F602><U+0001F602> I agree."
"1208","Dumbo Is a Masterpiece. 
Dumbo is my bae, and should not be hurt <U+0001F970>"
"1209","I don’t think i’m in the right emotional state to see Dumbo I cry watching the trailer"
"1210","@TimesNow @RahulGandhi @scribe_prashant Dumbo bimbos of @timesofindia .  Congress can't scrap Sedition law. It's only the Govt of the day which decides and congress is nowhere close to forming govt"
"1211","#UsMovie mind = blown.
#Dumbo interesting.
#Shazam Dr. Sivana and 7 sins vs 5 Shazam!"
"1212","Saw #Dumbo with a fellow Disney/Burton fan and I loved it &lt;3 I cried so hard xD and now I want to call my mom and tell her I love her &lt;3"
"1213","Who wants to go watch Dumbo with me?"
"1214","Going to see Dumbo! Hopefully I don’t cry my eyes out"
"1215","@TCIIIESQ @espn Lmao only part of this convo that is dumb is the dumb shit you’re saying <U+0001F602> FOH DUMBO"
"1216","@electricmano76 @TCIIIESQ @StevenZSmith @iamrianl @JemiKingBron @isaiahthomas I’ve been wrecking this dumbo all night with facts so thought I’d drop some more"
"1217","Mannnn I cried watching American Idol and Dumbo today what’s my problem"
"1218","Dumbo is legit the saddest Disney movie to exist, whyyyyyy did I subject myself to the live action movie? I was in there crying real tears <U+0001F62D>"
"1219","@fayedsouza Dumbo - do read up other subjects apart from just xtian propaganda !! You are a journo after all - secular and socialist were inserted by Indira Gandhi during the emergency! Make sense ??"
"1220","About to see dumbo in 3D i am TOO excited <U+0001F601>"
"1221","No puedo ir a ver Dumbo. It’s too much 4 me."
"1222","Dumbo <U+0001F418> is such an adorable movie!<U+0001F49C>"
"1223","@Hakeem05295938 @kiranokiran @atahasnain53 It is not based on war Dumbo It is based on policy of not bowing down to terrorism as in Mumbai attack when no action happened.
A country has every  right to defend itself."
"1224","@TheCosmicJester @mental_floss If you are a character in full costume (your face isn't visible) ie: Pluto, Mickey &amp; idk Dumbo, you're not allowed to speak at all, correct? Used to be true."
"1225","i wanna watch dumbo but general consensus of letterboxd gave the movie 2-3 stars rating and i'm usually with them so"
"1226","Modern cgi is incredible. We all knew you can make really realistic stuff, but dumbo proves we can finally realise the dream of doing terrorism to millions of children's brains with a horrific gibbering foreskin with eyes"
"1227","@wakuwakuboi I was hoping with the new dumbo movie we were gonna get some Casey merchandise"
"1228","I actually liked @Dumbo a lot more then I expected #Dumbo"
"1229","I really want to go see Dumbo :/"
"1230","Baby mine, don't you cry
Baby mine, dry your eyes
Rest your head close to my heart
Never to part
Baby of mine  “Baby Mine” -Dumbo"
"1231","@IIKosmosII @BeeBeeVR But the version i have has dumbo lyrics, help"
"1232","Gonna watch dumbo I’m excited <U+0001F629><U+2764><U+FE0F>"
"1233","@ashutosh83B @narendramodi @RahulGandhi Godse was prety clear what he did...and gave reasn y he did ...can you tell me dumbo Ashutosh why are you spewing a venum  everyay in our society???trust me you ppl are burden to the society...stop spitting bulshit everyday...warna keede padenge Ashu jee"
"1234","@JennyENicholson Disney Stans want to see Dumbo I guess"
"1235","@Nick_HBS I still think Christopher Robin is the best live action reimagining, Dumbo is a very close 2nd."
"1236","@erinbiba This is all just Dumbo sponcon, isn't it"
"1237","I wish Tim Burton directed The Addams Family not Dumbo."
"1238","Omg I wasnt expecting this movie to be sooo good <U+0001F643> — watching Dumbo"
"1239","i cry just thinking about dumbo there’s no way on gods green earth that I could watch the new dumbo movie and come out alive"
"1240","The strongest material in existence is adamantium. The second strongest is this dumbo old dmv registration sticker that I'm trying to peel off"
"1241","@flharps @RealSaavedra @morningmika @Morning_Joe Mika @morningmika is a wee bit of a dumbo.If she didn't have connections she would be doing the Channel 2 news in Timbuktu."
"1242","Hey @screenjunkies @MurrellDan when I saw @DisneyStudios' &amp; #TimBurton's #Dumbo I did notice a lot of the ""Tim Burton ingredients"" that you've mentioned are in all his movies; it has a hand thing, an old timey contraption, parent issues, and of course a very dark color palate."
"1243","DUMBO ('19 Burton): [C+] Mostly a sleepy, phoned-in effort from Burton, not helped by such a narratively static Kruger script, though the auteur does stir to life for the glorious flight sequences &amp; in-his-wheelhouse Dreamland-set scenes."
"1244","Y’all #Dumbo fucked me up good. Lord that was an amazing movie. Classic Burton, visually stunning, emotionally driven, strong characters, just an excellent movie overall. I’m not a big fan of the original but I could watch this over and over. But damn bring tissues for #BabyMine"
"1245","@NicPandolfi @Dumbo At least the weather’s not inclement"
"1246","i really want to watch dumbo :("
"1247","That was the first Disney movie I ever saw and I never want to see it again."
"1248","Dumbo will come back in Avengers Endgame"
"1249","More u Dumbo's do such things more steely becomes resolve of Indian public to vote in NaMo - problem is loss of credibility of Cong, RaGa &amp; you media persons"
"1250","@priyankac19 Oye dumbo leader of Congress. Read the full news. FB has removed more number of Congress pages around 700 pages for running ur agenda there. And read the amount spent on FB for ads by ur congressi losers. Chal Katt le yaha se adhe information , adha dhimaag wali.
@TajinderBagga"
"1251","Saw Dumbo.  Yes I actually liked it."
"1252","imagine if irene brought her dumbo soft toy to the dumbo screening i would cry"
"1253","Damn i never really thought about it like that...good thing i haven't seen the movie"
"1254","Let's make a live action Dumbo movie so it's more lifelike. 

Okay. And let's put the elephant's eyes in the front of it's head so it's more relateable."
"1255","@RahulGandhi 
@Kaalateetham

Dear #WayanadPappu

Please help these B MP employees and their families from yor Mom,s $2Bn  kiti till your incapable corrupt  congress govt pays their sakaries in time !!"
"1256","I feel like @bertkreischer is the living embodiment of my Dumbo Theory. 
That being: There’s a state past drunk one can drink themselves into where they can  unconsciously discover the ability to almost magical things. Like fly, as with the beloved pachyderm"
"1257","Going to see Dumbo &amp; Aladdin this month I can't wait I LOVE DISNEY"
"1258","she is the cutest woman in this universe don’t @ me"
"1259","I cried watching the damn trailer, and still not ready for the full live action version okay
Give me time
I'm still healing"
"1260","@Samster3 @ashutosh83B @narendramodi @RahulGandhi @ashutosh83B the super dumbo would not understand it..."
"1261","is this toby taking the piss or disney digging its serrated talons even deeper into the rotting carcass of brand twitter
place your bets now"
"1262","How to watch #Dumbo<U+0001F418> #LikeABoss?
<U+0001F60E>
Buy a nachos combo and start eating.

Offer some to the one sitting next to you.

Don’t offer too much.

Continue eating.<U+0001F37F>

When in #PVR, do as the #PVRFoodie does."
"1263","@SamDianeK @FilmCritHULK It is apropos that Hulk is watching Appa’s Lost Days right around the time all of us are most certainly not watching Tim Burton’s Dumbo. 

I think I had blocked out Dumbo the first time couple times I watched and didn’t make the connection."
"1264","Head to the theater for “Disney magic at its best.” #Dumbo is now playing in 3D!"
"1265","None of your business what I watch dumbass"
"1266","too many moments in #Dumbo where danny devito's silent. i guarantee they cut some of his lines. would see again if he was constantly talking"
"1267","If I don’t go see Dumbo soon, ima be pisssed"
"1268","@rupasubramanya Presenting selective facts post great fall in 2008. For this dumbo. 10 cent rise on 50 is same as 10 cent rise on 500. And She is a economist. @RahulGandhi you deserve better."
"1269","Mariya Takeushi sings the japanese version <U+0001F62E><U+0001F60D>"
"1270","@corbynbesson Her house dumbo <U+0001F923><U+0001F923><U+0001F923><U+0001F923>"
"1271","Dumbo with no context"
"1272","Watched #Dumbo &amp; it was so sad! I never cry in movies, unless it involves animals or old people getting hurt or being lonely. #Disney"
"1273","I really cried while watching dumbo today wow"
"1274","DUMBO type IQ of @INCIndia economist.
2013 boost was after @narendramodi nominated as a PM candidate by @BJP4India and reason of latest rally is again on same expectation, BJP comfortably coming back to power. It's al time high(read this in bold &amp; capital)

#ModiHaiTohMumkinHai"
"1275","I'm watching Dumbo ( the animated one) and I'm hurt man LOL"
"1276","what I wanna know is who tf agreed to a dumbo remake?? nobody wants to relive their childhood traumas"
"1277","// Off to bed since I got class tomorrow and I might go see Dumbo with my mom so I’ll be back later on tomorrow."
"1278","@NihilistZealot You ain't lying. Every day, it's some new bullshit. Today it was about Dumbo fat shaming people and tomorrow it'll be something else. I'm fat. I'm perfectly cool with Dumbo."
"1279","And honestly, i will never forgive Dumbo for that Jim Crow bullshit."
