"","text"
"1","Once your eyes are open, even things you already “know” look different. #vegan"
"2","The issue of dedicating more or less space to indie films aside, no self-respecting adult should be addressing most major studio releases at this point. Like, there shouldn't have been any ""criticisms"" of Dumbo. Not one. And literally nobody needs to write anything about Shazam!"
"3","listen here you dumbo, you are so fucking funny and im grateful for you i ***e, i hope you learn how to do maths, and thank you for saying happy birthday and singing hit or miss also can you please help me get a gf? please and thanks.
also you are cute or wtv"
"4","@Variety I didn’t enjoy the focus on the human story rather than Dumbo and the other animals. I missed the circus mouse that supported Dumbo. I especially HATED the casting choice of those children, especially the girl. No passion or expression. Visually? Perfect. Adult actors? Great.1/"
"5","Hahaha so Sharmila Farooqi wasn't the only dumbo to argue that SKMH should be renamed"
"6","@HillaryMonahan @aleksappleton I am STOKED to go see Us, but absolutely refuse to see Dumbo because it is way too fucking disturbing."
"7","@ameriporean I LOVE dumbo but I’m very much not a fan of the live action remake trend"
"8","I honestly can't remember if Dumbo has a voice in the original cartoon. All the other animals have voices. But does Dumbo?
Don't look up clips, give me a solid yes or no."
"9","whoever irene went to see dumbo with must have laughed so much seeing irene birthdays posters plastered everywhere around the mall...."
"10","So Dumbo didn’t do well at the box office. I can’t imagine why– they just took one of the most emotionally disturbing animated films and added an hour of plot, dour CGI, and a weirdly-humanoid elephant that looks like a melted child version of Stubby Kaye."
"11","I am hoping that Disney is going to start to take a look at all these remakes and the reception of #Dumbo and reevaluates the whole thing."
"12","On another note... lost count of date # but when you’re a hustler &amp; work hard.... you have my attention! <U+0001F60D> Excited for our movie night tomorrow! #Dumbo"
"13","@PaulaAbdul @Dumbo @Disney @AmazingLovelyGM I saw this and must think about you<U+0001F418><U+2764> How is the elephant that you adopted NDotto was it right? Elephants are magic"
"14","@Dumbo is amazing #ColinFarrell is always brilliant @DannyDeVito and @MichaelKeaton as-well especially these 2 first time in screen together since #batmanreturns it’s my favourite Disney live action remake to date even for me better than #BeautyAndTheBeast"
"15","@KyleOVox I've run into similar folks in real life. A friend once commented that Dumbo was dumb with no real reason WHY and my Dad complains that it's too sad. It's always nice when you run into people that like it though/"
"16","@chuckwoolery @gatewaypundit Not true. Number four. While still respectable, beat by Dumbo, US, and Captain Marvel. Marvel, by the way, was at $22 million in 3rd, while Unplanned was at $6.1 million."
"17","Someone take me to see Dumbo so I can be properly annoyed by it"
"18","I just saw Dumbo and it made me cry. This is where I’m at."
"19","Imagine going to the movies to see a mediocre live action remake of Dumbo. Why."
"20","sis all the people crying when dumbo’s mum gets taken away yet that’s what happens on a daily basis in the dairy industry with cows OPEN YOUR DAMN EYES"
"21","And BTW, the kids at the cinema I went to LOOOOVED #Dumbo"
"22","Baby #Dumbo was ABSOLUTELY ADORABLE!!!!!! Unfortunately the film didn’t live up to his cuteness."
"23","I was pleasantly surprised and amazed that the blatant the Vandemere=Disney and anti-capitalism messaging in #Dumbo got by the House of Mouse. What benevolent overlords....."
"24","#Dumbo wasn’t a disaster or bad film (it’s one of #TimBurton’s better films in a loooooong time, but that’s not saying much), but it dragged and I had some major qualms with flat line readings from the cast."
"25","uh, stop being dumb for a second. It’s a Tim Burton’s movie. Not for kids. Yes it’s disney and dumbo and ? If your kid is 8, he/she probably won’t like watching the nightmare before christmas. So? what is your point. Also, maybe if parents weren’t *this* dumb they’ll get it"
"26","irene: huffs and puffs about being called dumbo
also irene: goes along with it anyway because she loves us"
"27","@envinyon to be fair, the original Dumbo is frightening"
"28","The DUMBO remake was written by the screenwriter of the american GHOST IN THE SHELL in case y'all were wondering"
"29","Yes. 
I've just cried watching the new #Dumbo and I don't care"
"30","Ok I know it’s fake but the new Dumbo movie is cruel I hate it"
"31","My stepdad won't come to see Dumbo with me because he's gonna cry ffs if he's gonna then obviously I will"
"32","@PaulsMovieTrip @Dumbo @DisneyStudios Dumbo was always one of my favorites.  I just cry so many times when I watch it. The older I get the worse my crying in movies gets. I haven’t seen the new Dumbo for this exact reason. If I cried 2-3 times in the 60 minute classic, just how much more will I cry in this one!!  <U+0001F418>"
"33","I mean it was cute but I was expecting more"
"34","Catch me at the theater when this comes out"
"35","@LilaGraceRose @UnplannedMovie Dumbo was shown in 4259 locations. #Unplanned got an R rating, and with the lack of advertising factored in...the math is pretty amazing! As a retired principal, I feel that instead of putting a condom on a banana for sex ed, show the film. #prolife"
"36","For those curious, my top 5 Disney animated movies are:

- The Lion King
- The Jungle Book
- The Rescuers Down Under
- Dumbo
- Fox and the Hound

(Yeah you can see how I became a furry)"
"37","Going to the movies to see Dumbo. There’s gonna be 5 of us."
"38","Do I care about Dumbo or expect this movie to be great? Not really. But I haven’t been to the movies for a couple weeks now so here we are. Can’t beat my personal record from last year without a little stat padding."
"39","i’d see dumbo for danny devito and danny devito only"
"40","I’m going to see Dumbo this week and I’m so excited <U+2728><U+0001F418>"
"41","weird that the villain in the new dumbo is just.......... walt disney"
"42","Phew. This #Dumbo review is taking forever to upload. At least that gives me plenty of time to play around with a bunch of thumbnails!"
"43","Never really figured out how Barrack got that part when he never had acting experience  !!"
"44","I underestimated how much I fucking love the original Disney movies, I’m rewatching dumbo cuz I haven’t seen it in ages and wtf"
"45","The original dumbo is equal amounts nightmare fule as it is sad and I’m here for it"
"46","Does #VAVandevere have more than one walking stick?  I can't tell from clips and stills, and I was too overwhelmed during the film to notice.

 @Dumbo #Dumbo"
"47","Dumbo debuted with an estimated $45.0M this weekend.

#Dumbo  #BoxOffice  @DisneyStudios  @Dumbo"
"48","Dumbo debuted with an estimated $71.0M internationally.  Global total stands at $116.0M.

#Dumbo  #BoxOffice  @DisneyStudios  @Dumbo"
"49","Dumbo debuted with $45.99M this weekend.

#Dumbo  #BoxOffice  @DisneyStudios  @Dumbo"
"50","International debuts by market for Dumbo include:

China - $10.7M
U.K. - $7.4M
Mexico - $7.2M
Russia - $4.4M
Italy - $3.8M
France - $3.6M
Spain - $3.6M
Brazil - $2.5M
Japan - $2.4M
Australia - $2.1M

#Dumbo  #BoxOffice"
"51","@MrKarasch @Dumbo What if they played a lot of pong to practice first?"
"52","that shit with that xylophone <U+0001F511> <U+0001F418> <U+0001F496> Thanks for reading, -flippo the dumbo idiot <U+0001F414><U+0001F476>"
"53","If me and henry go see dumbo tomorrow I'm gunna do a slight bound of dumbo<U+0001F495>"
"54","Had a great time contributing to this BEC. Watch these instead of #Dumbo."
"55","I wanna see the new Dumbo movie now that I read the reviews saying its super depressing and sad and I'm so ready!!"
"56","More excellent #Dumbo posters by @PosterPosse artists @jeremy_pailler @LST_MIND @AdStothard @PAIDesign"
"57","It's good to know one of us is going to use the word ""good"" without using the word ""not."""
"58","irene went to see dumbo..... I hope she sees how cute the elephant is and doesn't wanna fight when we call her dumbo now"
"59","the way irene calls dumbo “that guy” as if she has some never ending beef with him <U+0001F62D>"
"60","Soooooo I'm trying to see dumbo

Who's trying to go see it?"
"61","I want to go see Dumbo and cry"
"62","i’ve seen more people making fun of dumbo advertising than ive seen actual dumbo ads"
"63","Can’t wait to watch Dumbo tomorrow<U+0001F418>"
"64","@KrishnanRajago4 @arunjaitley He is talking about when his govt dumbo"
"65","things i love: Tim Burton and Animal liberation. Dumbo was great"
"66","someone come see dumbo with me pls and ty x"
"67","I had so many thoughts on Dumbo that I'm considering making a YouTube channel just to talk about it"
"68","@Thathigga What if you have really big dumbo ears ....."
"69","Dumbo is the best live action disney remake period !"
"70","If you’re thinking of going to see dumbo, don’t"
"71","Just finished watching Dumbo. It was good but the cruelty in it made me really uncomfortable. (Yes, I know they weren't real animals but still)"
"72","Dumbo wasn't even enjoyable because I cried so much I literally had to run out of the cinema to take a breather at some point fuck my over emotional life"
"73","Dumbo wasn't even enjoyable because I cried so much,  had to run out of the cinema to take a breather at some point"
"74","@sarasymbiote @Gods_nerd @The_Spore666 Also those are literally just hoods

It’s part of the costume

This man is a dumbo"
"75","Dumbo also reported...

He doesn't need to hear from 40 year old white polar bears about his animated time, as it wasn't meant for them...

But this doesn't mean he hates white polar bears...

Did he mention... He doesn't hate white polar bears...."
"76","Dumbo also added he needs no love interest in his film as he is a strong, independent elephant..

Disney has released a comment that Dumbo is the most powerful, flying elephant in the Disney Cinematic Circus Universe...."
"77","News update from Dumbo...

Dumbo wants more diversity at his press conferences.

He's fed up of seeing too many white toxic polar bears...

He wants more giraffes, donkeys, and flamingos...

He's also getting a gofundme set up to send young elephants to see his film."
"78","The ending of the new Dumbo has made my heart full <U+0001F496>"
"79","@bobby_baseball @UnplannedMovie @Dumbo @UsMovie @FiveFeetApart @Twitter Even better, they passed @PPFA in total followers now!"
"80","Now that #March is officially over, here are the top 5 films of #March2019. 
#1: #CaptainMarvel 
#2: #UsMovie 
#3: #HowToTrainYourDragon3 
#4: #TylerPerry's #MadeaFamilyFuneral
#5: #Dumbo 

What did everyone see this month? Let us know in the comments!!!"
"81","Ramadan coincides with the Christian calender around the first week of May this year and Muslims around the world are observed in prayer and fast Agrabah being a Middle Eastern city. The trailer #Aladdin was shown at the screening of Dumbo and it looks really good"
"82","@AdamJoh91263469 Hi, thanx for liking and retweeting my tweet, #Dumbo @DannyDeVito was on my list of movies to watch this year and I have grown to like the movie since watching. I don't know what it is about the movie that got me to like it. I do like it."
"83","@HillaryMonahan @HildieTallgem Honestly, I had NO idea they were redoing Dumbo. <U+0001F937><U+200D><U+2642><U+FE0F>"
"84","@JimHillMedia @Variety Whereas even though people thought Dumbo had potential, once early screenings rolled in and they were lukewarm at best, combine that with an audience that wasn't nostalgic enough for Dumbo and you see the numbers you have right now. (cont)"
"85","@JimHillMedia @Variety I predicted that Dumbo could have been the surprise hit, Aladdin the tepid one, and Lion King the best one, but now I feel Aladdin could end up being the surprise hit since people, even with far better footage, are beyond adamant with it. (cont)"
"86","@JimHillMedia @Variety The article had the same reasoning as I did; while Dumbo is a beloved character in the fandom, he is not as popular or as relevant. And even though you can be cynical and say that remake fatigue is finally hitting Disney fans, not that even the loudest of (cont)"
"87","I can't stop thinking about Dumbo since last night. Such a complicated, subversive, moving piece."
"88","I thought the Dumbo movie was cute, but it ruined Colin Farrell for me.<U+0001F629> I’m going to have to watch S.W.A.T or fright night or any of his other movies. The fake cowboy accent.<U+0001F922>"
"89","@joeycsims It's a good day for gumbo, actually, it's freezing out there. Maybe Dumbo, then gumbo."
"90","Such an exciting and fun project working on @Dumbo  through @PosterPosse and @DisneyStudios ! What an opportunity for this Northern Ontario boy! <U+0001F4AB>"
"91","Went to see Dumbo tonight.. I've cried during the whole movie. Tim Burton is just the best when it comes to picture the different and the outcasts. Magical movie. I'm in love <U+2764> #dumbo #disney @Dumbo"
"92","This. And they doubled down with Tim Burton."
"93","@karlcomptonfans @talkSPORT @talkSPORTDrive Adrian Dumbo your beloved The Ranger's lost 2-1 and all you do is attack our Captain with your mealy mouth word's!Your hate of Celtic show's"
"94","@rachelfaith97 Agreed. Can they make the cg Dumbo convey emotion the way the animated Dumbo does?"
"95","I really really want to see the dumbo movie <U+0001F62D>"
"96","@tommy_k77 The movie Us, Dumbo"
"97","The very things that hold you down are going to lift you up. – Timothy Mouse, Dumbo"
"98","Watch the hell out Dumbo. Next time I see you, there’s gonna be two hits. Me hitting you, and you hitting the ground."
"99","@flex_lm @nite0wl not going to lie, that's a pretty good one.

But dog_rates and dumbo. FOR SHAME. :("
"100","I was about to watch dumbo last sunday but it was fully booked so we ended up watching eerie instead"
"101","I’m reading reviews for the new @Dumbo movie &amp; it sounds just like @realDonaldTrump ‘s “presidency.”

This critic said, “There’s a lot going on in the movie, none of it entirely coherent...”

#FollowBackResistance 
#Resist"
"102","Under why reasons my sad ass will not be seeing it."
"103","the world needs less cole and more dumbo , dumbo"
"104","@ERJgames Does Dumbo talk for sure? Yes or no? Fate of the world rests in your hands."
"105","@Bandygrass @IvanDashSmith So Dumbo is a silent protagonist like the character in GTA 3."
"106","The first thing they should've done when they found out Dumbo could fly is put that animal in a fucking diaper."
"107","The rate dogs guy is shilling for dumbo instead of woke films like Ex Machina. Classic"
"108","who wants to go see dumbo"
"109","@Dumbo My congratulations !!!! <U+0001F49A><U+0001F49A>"
"110","@Dumbo I love this song!!!"
"111","Yes <U+0001F4AF> But also remember that this happens to REAL HUMANS at the border. #ZeroTolerance"
"112","deciding to give up art and music and gamedev to become a gimmick account and sell out to advertise for the dumbo movie"
"113","@RealBobMortimer go and see the new Dumbo - there is a very subtle version of the @AthleticoMince South African in it."
"114","My eyes are filled with tears just thinking about it. Hard pass."
"115","@Reece_Lively @spidey_squad @EvanFilarca Ok, but i still want to see Dumbo"
"116","@Zebastian_D The people that grew up watching dumbo are adults now and Noone wants to be subjected to the tears that movie brings <U+0001F629>"
"117","Like guys.....original Dumbo was animated......guys I hate to break this to you but the only anything of color in the original were the crows, are you saying you wanted Jim Crow to be in the movie"
"118","@DavidLammy @facebook So imagined  'white nationalism' is evil and dangerous without any proof? This man is the biggest dumbo yet."
"119","Wow, it looks as though Fishermens Friends movies has grossed £4.8M in just two weeks! Fantastic achievement. Global distribution results should be interesting then.
@Fishy_Friends @FishermansFilm"
"120","#Dumbo Rotten Tomatoes score (52%) is surprising, I could have sworn I saw multiple tweets calling it magical and Tim Burton’s best film in years."
"121","Really enjoyed the @Dumbo movie tonight @Everymancinema with the niece and nephew,the smile on my nieces face seeing Dumbo fly for the first time,priceless <U+0001F44D><U+0001F3FB>"
"122","me and my stuffed fren sebastian. are heading to the movies. because there's a very special film. about an elephant named #dumbo. who looks just like sebastian. and is almost as magical #ad"
"123","Well I watched the new Dumbo and I can't believe they nicknamed him ""Big D""..."
"124","now that i think about it i’ve never watched dumbo myself"
"125","@RiviasHunter of a wonderful story. Dumbo is one of the best while also one of the most unappreciated stories. It shows although we are different in many ways. We are all important in all ways. Sorry for going a little deep. I just love the story of Dumbo."
"126","@RiviasHunter Dumbo I have seen the animated classic. I am going to see the live action. You have to remember in all great stories that are played, or even read in books. Their is happiness along with sadness. You have to have opposite to enjoy the true meaning"
"127","Pooh and dumbo"
"128","To all the big kids out there that love Disney 1000% recommend dumbo !"
"129","Was watching Dumbo in the cinema and Patrycja whispers over to me “it’s so fake” um yeh didn’t think it was gonna be a real flying elephant"
"130","@LisaMei62 I am so sick of this deep state clown, it’s time to take these people down for the treasonous acts they committed, Right Dumbo."
"131","@farleyxbenoist So did @Lenod !!!! I would take dumbo with me if I had one. PS: I took paddington to the cinema with me to see paddington."
"132","Disney exec: Let’s take the saddest film in our vault and make it MORE REALISTIC."
"133","@not__vee @WhyIsChester so where does that leave another Disney film like DUMBO, which is underperforming and has been shrugged off by critics?"
"134","Also I am not ready for this @Dumbo movie... the trailer alone makes me cry."
"135","@RyanRibbity LJNKFKKHGH, If it weren’t for the dumbo, I would be fine with this"
"136","@RiseFallNick I had a feeling audiences would get tired of these remakes eventually.
I still believe Lion King will make billions but after that they don’t have much catalogue titles as revered as that film.

Still with how Dumbo opened, it’s clear the novelty of these remakes is growing thin."
"137","@eScarry Eddie, You don't want the mess that is coming, repent dumbo."
"138","I love children movies (*<U+0E05>´<U+02D8><U+0E05>`*) I just watched wonderland park xoxo now dumbo I’m so excited it starts shortly!"
"139","is #Dumbo as bad as everyone is saying? I wanted to see it."
"140","Does the new Dumbo movie have the same psychedelic scene as the original film? That is essential to the plot and the mood of the film."
"141","So you're that guy haha cutie"
"142","I’ve just watched @Dumbo ... wooooow It’s very sad and very beautiful as well.. I must say.. #ColinFarrell stole my heart once again <U+0001F927><U+0001F60D><U+2764><U+FE0F> and Dumbo is so cute <U+2764><U+FE0F>"
"143","Buzzin to watch dumbo tomorrow with ma boyyyy"
"144","Just so emotional rn and seeing dumbo wasn’t a good idea<U+0001F62D>"
"145","a Powerful Observation by karen han"
"146","I must see very special movie.. Flappy elephant.. Oh #dumbo you are jus like me.. my smal friend.. Elephatn.. Buildings collapsing and blowing up"
"147","Also the racism. Dumbo begins with racism as the faceless Black men build the tents and ends with a Crow named Jim singing ""I be dun seen bout everything"""
"148","Such an incredible and tear jerking movie! I loved every minute <U+2764><U+FE0F>"
"149","@Jo_Osmond @EddOsmond @DannyDeVito @MichaelKeaton just got back from watching @Dumbo absolutely amazing!! Has to be my favourite film ever can't wait until the dvd is released already pre ordered dvd before saw the film"
"150","Still need to catch #Dumbo, I'll always give Tim Burton a watch, plus some people's readings of the film (positive or negative) have me more intrigued. What with that, #PetSematary, #Shazam and #WrestleMania35, and work of course, I'll have to plan this week out I reckon."
"151","Only on theaters!"
"152","Hmm... I'm not so sure about Beauty and the Beast. Totally up for a The Sword in the Stone version, though!"
"153","Dumbo is truly a magnificent piece of artwork and Tim Burton is truly the gift that keeps on giving"
"154","im bout to just say fuck it and go see Dumbo by myself"
"155","Currently in the cinema watching Dumbo and it’s so bad I can’t believe I paid 15 euro to see this shit in IMAX fuck Colin Farrell and his shit American accent"
"156","@Disney I couldn't be less interested in this film, truly. I am seeing Dumbo tonight and thus far enjoy most of your live action adaptations, but there's an over-saturation and their congested release schedule don't make it something to look forward to."
"157","Seeing three movies this week. #Shazam #PetSematary #Dumbo"
"158","Idea for Disney: Instead of live-action versions of old animated films (""Beauty and the Beast,"" ""Dumbo"") everyone has seen, it should make animated films of its live-action films that no one remembers, like ""The Happiest Millionaire"" and ""Superdad."""
"159","Going to the movies to see Dumbo out in Cali tonight and then 2mrw Disneyland Park <U+0001F44D><U+0001F3FE><U+0001F642> #anaheim #calivacation <U+0001F334><U+2708><U+FE0F> I’m taking a #palmtreeleaf home b4 I leave back to Boston Sunday idc <U+0001F606><U+0001F602><U+0001F642>"
"160","@FrankPa97450365 @CineplexMovies Probably tomorrow. That's been the rumoured date for a while and it kind of makes sense that they'd go up after Dumbo's opening weekend."
"161","@yeeyee869 @bewyldbeks @ReadMoreScience What counter examples? That you and the people you know had classes? When states and school districts can deny are allow denial of classes by parents. Not to mention most catholic school parishes don’t have them at all. The system OVERALL is fucked, big picture here dumbo"
"162","Disney needs better promotion with Dumbo...they gave it a good ending. The song, Baby Mine has always touched ppl. when hearing it...need to play it more."
"163","@anthonysthots @Disney I watched Dumbo and was unimpressed, animation was better."
"164","Maybe I’m vegetarian because of being traumatized by animal deaths in Disney movies. They molded my mini empathetic soul into who I am today."
"165","@senedjem 1000/10 would rewatch #dumbo<U+0001F418> then crawl out of burning wreckage and strewn carcasses"
"166","It’s reported, Mueller investigation was suppressed for 8 months, prior to 2018 elections, giving Dumbo-Rats platform against PT&amp; Republicans to win 2018 House. Anyone participating in this crime, “Obstruction of Justice,” delaying “NO Collusion” outcome be prosecuted to the full"
"167","Did you catch a new film over the weekend? Tell us what you thought of #Dumbo #UsMovie #FishermansFriendsFilm #CaptainMarvel in the medium of a Four Word Film Review and tag #fwfr #myvue to be in with a chance of winning a pair of complimentary tickets!"
"168","@vuecinemas Family entertainment, childhood memories, beautifuly made, inspiring
<U+0001F418> #Dumbo #fwfr #myvue"
"169","The dumbo movie was alright, I loved the song “Baby of Mine”  and some of its ideas, I love the mermaid girl and dumbo was just the cutest thing"
"170","Dumbo was sad.

Leave that nigga alone. That’s why he can fly and about to get all the bitches."
"171","@ashlae_nikoal @Jamie221b No pink elephants? I AM SOLD.

I hated the original Dumbo as a child. I had horrific nightmares about those pink elephants, and the crows creeped me out. But the more I hear about the live-action one, the more I want to see it!"
"172","@SuzanneWinland Just went to see Dumbo this last weekend...I cried like 3 times.

I am SO tired of human asshattedness.  We really dont have to be the most cruel and vile of all of the earth's imhabitants.

Really
  We dont"
"173","So... I have no interest in live action Dumbo.

Am I alone in this?"
"174","Mum has an online boutique and currently in stock is this awesome #Dumbo<U+2060> <U+2060><U+2060> <U+2060> duvet set, if anyone’s interested, #PM me via here or @TreatsTeddy  #ShopWithLollipop #LollipopTheTeddy #LollipopTheBear #BloggingLife #DisneyDumbo<U+2060> <U+2060> @Dumbo #BloggingBoutique #ShoppingBlog <U+0001F36D><U+0001F43B>"
"175","Mum has an online boutique and currently in stock is this awesome #Dumbo duvet set, if anyone’s interested, #PM me via here or @TreatsTeddy for more info #ShopWithLollipop #LollipiopTheTeddy #LollipopTheBear #BloggingLife #DumboMovie @Dumbo #BloggingBoutique #ShoppingBlog <U+0001F36D><U+0001F43B>"
"176","Mum has an online boutique and currently in stock is this awesome #Dumbo<U+2060> <U+2060> duvet set, if anyone’s interested, #PM me via here or @TreatsTeddy  #ShopWithLollipop #LollipiopTheTeddy #LollipopTheBear #BloggingLife #DisneyDumbo @Dumbo #BloggingBoutique #ShoppingBlog <U+0001F36D>"
"177","Mum has an online boutique and currently in stock is this awesome #Dumbo<U+2060> <U+2060><U+2060> <U+2060> duvet set, if anyone’s interested, #PM me via here or @TreatsTeddy  #ShopWithLollipop #LollipiopTheTeddy #LollipopTheBear #BloggingLife #DisneyDumbo<U+2060> <U+2060> @Dumbo #BloggingBoutique #ShoppingBlog <U+0001F36D><U+0001F43B>"
