"","text"
"159","Distasteful journalism from @PaulKimmage. Copy and pastes snippets of other people's work and the only real insight into his week in Augusta is a meaningless encounter with another writer"
"160","Paul reminding everyone that Tiger's an asshole. 

<U+0001F44F><U+0001F44F><U+0001F44F><U+0001F44F><U+0001F44F>"
"161","**More Sneak Peeks**

I found a beautiful princess in the bluebell woods <U+2764><U+FE0F>

This little lady is growing so fast &amp; was an absolute joy to see again.

These beautiful flowers will only be around for a couple more weeks...I have a few days left available <U+263A><U+FE0F>"
"162","There is a bed of these in the woods in Annaghdown.  I miss them all the time.  Also the television that someone tried to hide in a tree by the wall.  Oh the stories.  #annaghdown"
"163","@TessaThompson_x @LittleWoodsFilm I will see Little woods this week hopefully at Wilmette only place it is playing. Big Hug from Me! Congrats!"
"164","#losangeles #indiefilm fans need to see #FastColor .@BeNaturalMovie and #LittleWoods all directed by women, all opened this weekend and all at risk of not showing theatrically after this week! cc .@juliahartowitz .@_pamelabgreen #NiaDecosta"
"165","note to self to watch both of these, esp Fast Color <U+2728>"
"166","i'm calling it a western because 
a) the yeehaw agenda
b) i read an article about fast color and little woods today and i got inspired.
so i got a vague idea yesterday and wrote the entire thing today after church. enjoy and rt to spread my ministry"
"167","“When you’ve live under pressure from not only your parents but your siblings and then go out and live in the woods for the remainder of your life? There’s only so much you can do for fun.”

    His own hands get shoved into his front pants pockets."
"168","Taking myself on little jaunt in the woods later because life is good, today is mine, and tomorrow can wait. It's the little things."
"169","Facts... 
but know, for a lot of Black people,  where they live don't never get them ""limited release"" movies 

i can't support what i don't have access too 

not 1 of these movies is showing any where near me"
"170","Hmmm I want to go see Little Woods. There's a showing in 2 hours or a showing 5 hours from now. <U+0001F914> Where does a nap fit into this calculation?"
"171","@Jimmy_deVille Walk in the woods with picnic and very little choc so far, hope you have had a great one too"
"172","WOW please every go see Little Woods"
"173","Interesting story about woods. Is it the same in mma circles with @TheNotoriousMMA or John Jones.  Or Phil Taylor in the darts. I think lots of football players are the same  the persona they have in public belies their arrogant image behind the scenes."
"174","Not even summer yet. So sad and worrying"
"175","when we came to the woods
little creeks of flu sweat tickling our scalps
in false furs"
"176","As usual : a fan with a typewritter. If he loves someone he will push warm anecdotes in his  opinion piece and if he doesn't like someone he will go personal and show only the bad side.
Not a journalist <U+0001F44E>"
"177","@utheriN @MihrThakar Below expectations.... not out of the woods yet. Heavy clouds are  forming but with little follow-through rainfall"
"178","Not to be a dick but imagine rolling out for a movie simply because of the race/gender of its director"
"179","Enjoy all of the #FamilyFun that hot #Daughter @kwoodsxxx experiences  with her #Daddy #ANAL training and #ANAL #fucking her cute little  #asshole whle they hide their activities from #Mommy <U+0001F336><U+FE0F><U+0001F4A6><U+0001F952><U+0001F4A6><U+0001F346><U+0001F9E8><U+0001F525>"
"180","I’ll be going o see #FastColor this weekend to support @juliahartowitz:) and to impress @ava <U+0001F60D><U+0001F60D><U+0001F60D><U+0001F60D> Congrats Jules!!!!!"
"181","Little Woods isn't showing anywhere near me and I am very disappointed, I need to see it"
"182","@CllrDanMcD @medway_council @naushabahkhan @ClivJoh @CllrAndyStamp @PatCoop91879588 @AdamNthgill @MedwayLabour This. Was in Gillingham for a service at St Marks on Thursday night. Littlewoods Car Park strewn with months worth of litter. And I had to pay for the privilege. And move my car after two hours. Its like the council don't care about Gillingham because poor people."
"183","Going today to see Fast Color!"
"184","So done with this. Gillingham deserves better"
"185","Why does Kimmage still get to write for papers? Joyless take filled with references to rumours about Tiger’s personal life (he doesn’t tip apparently, who cares?!) and if he has “changed”. Not edgy, not controversial, just bitter."
"186","A man begs the PCs to find his daughter lost in the woods.  After a few hours in the forest, they find the same man--now in a wig--claiming to be a lost little girl.

He swears he just wanted to feel important enough to be rescued by heroes.

#BadRPGHook #DnD #RPG #TTRPG"
"187","@franklinleonard And complicating the equation is the fact it was released same weekend as Little Woods."
"188","This is so very sad to see <U+0001F614>  I expect it was started deliberately by school children as it's the holidays, happens every time they are off!  Thank god they are going back to school this week!  #Menace"
"189","Can def relate to this ....

""Well, what do you think?"" I asked.

He face was a portrait of confusion and despair.

""I feel nothing,"" he said."
"190","But will they be in theaters near anyone?"
"191","@wwmtnews Read:

I am as miserable and scared as a little girl lost in the woods at night."
"192","Little Woods picks a fascinating backdrop (North Dakota’s energy boom) for its tale of healthcare-driven economic desperation, and Tessa Thompson is very good. Would it’ve killed somebody to turn a light on?"
"193","@PaulKimmage it’s really getting embarrassing for you now Paul, the chips on your shoulders begrudge any sportsman achieving anything, @TigerWoods is the greatest we have ever seen. You admitted to cheating at your chosen sport, being controversial is all you have left #verysad"
"194","In @MatthewACherry fashion, I’m buying somewone a ticket to go watch Little Woods 4:30! at Nuart Theatre. SUPPORT BLACK WOMEN IN FILM!!!"
"195","@TessaThompson_x yup just drove 40 miles to do it and see this movie <U+0001F62C> #LittleWoods"
"196","Gots to go!!!"
"197","@Ironhorse76 Filthy little pagan that I am, I spent the day in the only church I know. I hope walked, heart open and spirit joyful, through the newly greening woods, foraged nettles and fiddleheads, picked up trash left by less grateful humans, and prayed just by breathing. <U+0001F496><U+0001F300><U+0001F496>"
"198","@Danger1652 I have a little surprise for you next month it has something to do with a suit wearing long arms and legs and a few woods I found in on Xbox for just 1,99€ so just you wait"
"199","Fast Color was amazing. A thoroughly well written and excellently acted movie today told a beautiful story of healing, growth, and trust. 

Highly recommend!"
"200","@ValerieComplex Yeah. I read the real number was 25 maybe and that it will only play until the end of the weeks. Little Woods isn't doing much better."
"201","Little Woods and Fast Colors got released in only eight places I swear."
"202","See @juliahartowitz film #FastColor in theaters now."
"203","Little Bit of Lovin by Roy Woods is so groovy ugh I adore it"
"204","@HarleyQuinnRN You’re a better woman than I am! I constantly fall off the diet wagon, drag it into the woods, set it on fire, and use the insurance money to buy Little Debbie snacks. I need to lose a large amount. Literally 100 pounds."
"205","@X3MN45 /He's relieved at the least at their acceptance.
/He can only take so much;

/With the little ones in tow he lets the shadows guide his steps and makes way through the woods to their destination, stepping out to where Xemnas is settled.

...
Well..
There are worse places to hide."
"206","Getting a chance to see both #HighLife  and #LittleWoods  this weekend really made a great time at the movies . With #LittleWoods  really blowing me a way"
"207","LOVE HER LITTLE BUTHOLE

#TASTYLATINPORN #TASTYPORN #xxxconnections #porn #xxx #bendmeover #porno #anal #naked #ameteurporn #tits #boobs
#latinconnections #latindating #connecioneslatino #dating #latinconnects #datingwebsite  #conciergexxx #supergusta #retweet #RT #greatcontent"
"208","Irish sports writing is in the absolute gutter. Don't exactly see the point of this article? Other than to poke fun at Tiger really. Kimmage and his wannabe mate MacKenna genuinely haven't a clue about the sports they cover and thrive off controversy. Pair of losers."
"209","Super dejected and broken about job prospects and being shot down, so playing some of my steam backlog to heal a little, started with Night in the Woods, and man, that is not what I need right now. Tabling that one..."
"210","@TribridOfChaos ""Are you sure we're going to a movie or to a woods to be the plot of a horror movie?"" 

He asked with a joking tone. He liked the time spent with her but didn't exactly want to get lost. The last time he was lost he died.

""We could at least drive around A little bit."""
"211","Through-backs: The (not so) little fox stuck in the woods, tried to survive and learn things. He feels thankful and blessed with a new clusters, the hopes, watching the old ones finally jumped over the rocks.
#randommondaythoughts"
"212","@valkyrieIoki She's really going? I thought she would be busy with promoting Little Woods!"
"213","I can't wait to learn and see much more from @NiaDaCosta.  I can't wait to see her upcoming movie. #littlewoods"
"214","We have two strong films out this weekend with @juliahartowitz's #FastColor and @NiaDaCosta's #LittleWoods. Go see both of them!"
"215","@ava @gugumbatharaw @LPToussaint @TessaThompson_x Two festival favorites from last year! I can't be more prouder of my quote appearing in the Little Woods trailer!"
"216","Three of these are playing @mdffparkway"
"217","Most of these aren’t available near me but if you live in a bigger city that has any of these films, please go check them out!! Looking at you, my LA and NYC friends especially."
"218","More interviews and (hopefully) some good news on some job leads starting tomorrow and for the rest of the week, but not out of the woods yet.  Still wrestling in trying to cover a car insurance and rent payment while out of work.  Any little bit that can be spared helps a lot."
"219","Saw #LittleWoods yesterday, #FastColor today, and hoping to hit the trifecta with #Rafiki tomorrow. Support Indie Films, support Female Filmakers, and support #BlackGirlMagic"
"220","Saw Little Woods yesterday, Fast Color today, and hoping to hit the trifecta with Rafiki tomorrow. Support Indie Films, support Female Filmakers, and support #BlackGirlMagic"
"221","just you and @ava talking about the same EXACT films, nbd <U+0001F440>"
"222","just you and @ava talking about the same EXACT films, nbd <U+0001F62E><U+0001F440> @OnlySharaeRae"
"223","@GeeScottSr @TheMikeSalk Using Woods as an argument against competition being the main reason is a little bit of a crutch... he is a generational anomaly when it comes to his transcending his sport. Don’t let the outlier of all outliers be your go to arguement for that, weakens your actual point."
"224","Also how the hell are there only 2 theaters in the LA area showing LITTLE WOODS? This is a crime."
"225","Here's to more and many, and many and more, and MORE and MANY. . .worlds of talent. x"
